{
  "task_id": "roadmap_task_1",
  "title": "1. Codebase Structure & Optimization\n- **Refactor redundant modules and functions** for improved mai...",
  "description": "1. Codebase Structure & Optimization\n- **Refactor redundant modules and functions** for improved maintainability and readability. Prioritize files with high cyclomatic complexity (Priority: High).\n- **Automate code formatting and linting** using tools like Prettier and ESLint, ensuring consistent style across the codebase (Priority: High)[1].\n- **Modularize large files** by splitting monolithic components into smaller, reusable units (Priority: Medium).",
  "files_to_modify": [
    "src/css/",
    "*.scss",
    "src/styles/",
    "*.css"
  ],
  "implementation_steps": [
    "Review existing component structure",
    "Implement component improvements",
    "Add or update component tests",
    "Update component documentation"
  ],
  "complexity_score": 10,
  "implementation_plan": "## Implementation Plan for: 1. Codebase Structure & Optimization\n- **Refactor redundant modules and functions** for improved mai...\n\n### Complexity Assessment\n- Complexity Score: 10/10\n- Estimated Duration: 90-120 minutes\n- Priority: medium\n\n### Target Files/Directories\n- src/css/\n- *.scss\n- src/styles/\n- *.css\n\n### Implementation Steps\n1. Review existing component structure\n2. Implement component improvements\n3. Add or update component tests\n4. Update component documentation\n\n### Success Criteria\n- All implementation steps completed successfully\n- Code changes follow project standards\n- Appropriate tests added or updated\n- Documentation updated as needed\n\n### Risk Assessment\n- Complexity Level: High\n- Breaking Change Risk: Low\n- Testing Requirements: Extensive",
  "status": "completed",
  "execution_time": "2025-08-26T04:25:16.224495",
  "estimated_duration": "90-120 minutes"
}