{
  "task_id": "roadmap_task_8",
  "title": "4. Enhanced Mobile Experience\n**Priority**: \ud83d\udfe1 **MEDIUM**\n**Files to Update**:\n- All React components...",
  "description": "4. Enhanced Mobile Experience\n**Priority**: \ud83d\udfe1 **MEDIUM**\n**Files to Update**:\n- All React components for responsive design\n- CSS for mobile optimization\n\n**Tasks**:\n- [ ] Optimize settings panel for mobile screens\n- [ ] Implement touch-friendly chat interface\n- [ ] Add progressive web app (PWA) capabilities\n- [ ] Create mobile-specific voice input experience\n- [ ] Optimize performance for mobile devices\n\n---\n\n## \ud83d\udd27 Technical Implementation Guide",
  "files_to_modify": [
    "src/"
  ],
  "implementation_steps": [
    "Review existing component structure",
    "Implement component improvements",
    "Add or update component tests",
    "Update component documentation"
  ],
  "complexity_score": 10,
  "implementation_plan": "## Implementation Plan for: 4. Enhanced Mobile Experience\n**Priority**: \ud83d\udfe1 **MEDIUM**\n**Files to Update**:\n- All React components...\n\n### Complexity Assessment\n- Complexity Score: 10/10\n- Estimated Duration: 90-120 minutes\n- Priority: medium\n\n### Target Files/Directories\n- src/\n\n### Implementation Steps\n1. Review existing component structure\n2. Implement component improvements\n3. Add or update component tests\n4. Update component documentation\n\n### Success Criteria\n- All implementation steps completed successfully\n- Code changes follow project standards\n- Appropriate tests added or updated\n- Documentation updated as needed\n\n### Risk Assessment\n- Complexity Level: High\n- Breaking Change Risk: Low\n- Testing Requirements: Extensive",
  "status": "completed",
  "execution_time": "2025-08-25T20:22:09.873552",
  "estimated_duration": "90-120 minutes"
}