{
  "completed": 3,
  "failed": 0,
  "total": 3,
  "completed_tasks": [
    {
      "task_id": "roadmap_task_1",
      "title": "1. Codebase Structure & Optimization\n- **Refactor redundant modules and functions** for improved mai...",
      "description": "1. Codebase Structure & Optimization\n- **Refactor redundant modules and functions** for improved maintainability and readability. Prioritize files with high cyclomatic complexity (Priority: High).\n- **Automate code formatting and linting** using tools like Prettier and ESLint, ensuring consistent style across the codebase (Priority: High)[1].\n- **Modularize large files** by splitting monolithic components into smaller, reusable units (Priority: Medium).",
      "files_to_modify": [
        "src/styles/",
        "src/css/",
        "*.css",
        "*.scss"
      ],
      "implementation_steps": [
        "Review existing component structure",
        "Implement component improvements",
        "Add or update component tests",
        "Update component documentation"
      ],
      "complexity_score": 10,
      "implementation_plan": "## Implementation Plan for: 1. Codebase Structure & Optimization\n- **Refactor redundant modules and functions** for improved mai...\n\n### Complexity Assessment\n- Complexity Score: 10/10\n- Estimated Duration: 90-120 minutes\n- Priority: medium\n\n### Target Files/Directories\n- src/styles/\n- src/css/\n- *.css\n- *.scss\n\n### Implementation Steps\n1. Review existing component structure\n2. Implement component improvements\n3. Add or update component tests\n4. Update component documentation\n\n### Success Criteria\n- All implementation steps completed successfully\n- Code changes follow project standards\n- Appropriate tests added or updated\n- Documentation updated as needed\n\n### Risk Assessment\n- Complexity Level: High\n- Breaking Change Risk: Low\n- Testing Requirements: Extensive",
      "status": "completed",
      "execution_time": "2025-08-27T04:26:03.341423",
      "estimated_duration": "90-120 minutes"
    },
    {
      "task_id": "roadmap_task_2",
      "title": "2. Music AI/ML Trends & Integration\n- **Integrate state-of-the-art music feature extraction librarie...",
      "description": "2. Music AI/ML Trends & Integration\n- **Integrate state-of-the-art music feature extraction libraries** (e.g., librosa, Essentia) for enhanced audio analysis (Priority: High).\n- **Prototype generative music models** (e.g., MusicLM, Jukebox) for AI-driven composition or remix features (Priority: Medium).\n- **Implement Retrieval Augmented Generation (RAG) pipelines** for smarter music recommendations and metadata enrichment[2] (Priority: Medium).",
      "files_to_modify": [
        "src/"
      ],
      "implementation_steps": [
        "Analyze current implementation",
        "Identify specific changes needed",
        "Implement the changes",
        "Test the implementation",
        "Update documentation if needed"
      ],
      "complexity_score": 10,
      "implementation_plan": "## Implementation Plan for: 2. Music AI/ML Trends & Integration\n- **Integrate state-of-the-art music feature extraction librarie...\n\n### Complexity Assessment\n- Complexity Score: 10/10\n- Estimated Duration: 90-120 minutes\n- Priority: medium\n\n### Target Files/Directories\n- src/\n\n### Implementation Steps\n1. Analyze current implementation\n2. Identify specific changes needed\n3. Implement the changes\n4. Test the implementation\n5. Update documentation if needed\n\n### Success Criteria\n- All implementation steps completed successfully\n- Code changes follow project standards\n- Appropriate tests added or updated\n- Documentation updated as needed\n\n### Risk Assessment\n- Complexity Level: High\n- Breaking Change Risk: Low\n- Testing Requirements: Extensive",
      "status": "completed",
      "execution_time": "2025-08-27T04:26:04.342156",
      "estimated_duration": "90-120 minutes"
    },
    {
      "task_id": "roadmap_task_3",
      "title": "3. Spotify API Usage Patterns\n- **Optimize API request batching and caching** to reduce latency and ...",
      "description": "3. Spotify API Usage Patterns\n- **Optimize API request batching and caching** to reduce latency and improve rate limit handling (Priority: High).\n- **Expand Spotify integration** to support playlist...\n                \n                [Full research results in autonomous session: .autonomous-coding-session/research_cycle_1.md]",
      "files_to_modify": [
        "src/api/",
        "src/routes/",
        "src/endpoints/"
      ],
      "implementation_steps": [
        "Review API endpoint specifications",
        "Implement endpoint changes",
        "Add input validation and error handling",
        "Update API documentation",
        "Add endpoint tests"
      ],
      "complexity_score": 10,
      "implementation_plan": "## Implementation Plan for: 3. Spotify API Usage Patterns\n- **Optimize API request batching and caching** to reduce latency and ...\n\n### Complexity Assessment\n- Complexity Score: 10/10\n- Estimated Duration: 90-120 minutes\n- Priority: medium\n\n### Target Files/Directories\n- src/api/\n- src/routes/\n- src/endpoints/\n\n### Implementation Steps\n1. Review API endpoint specifications\n2. Implement endpoint changes\n3. Add input validation and error handling\n4. Update API documentation\n5. Add endpoint tests\n\n### Success Criteria\n- All implementation steps completed successfully\n- Code changes follow project standards\n- Appropriate tests added or updated\n- Documentation updated as needed\n\n### Risk Assessment\n- Complexity Level: High\n- Breaking Change Risk: High\n- Testing Requirements: Extensive",
      "status": "completed",
      "execution_time": "2025-08-27T04:26:05.342984",
      "estimated_duration": "90-120 minutes"
    }
  ],
  "failed_tasks": [],
  "execution_timestamp": "2025-08-27T04:26:06.343567",
  "session_id": "autonomous-20250827-042427",
  "cycle": 1
}