{
  "task_id": "roadmap_task_10",
  "title": "2. Integrate Enhanced Chat Interface\n```bash\n# Import the enhanced chat component\nimport EnhancedSpo...",
  "description": "2. Integrate Enhanced Chat Interface\n```bash\n# Import the enhanced chat component\nimport EnhancedSpotifyChatInterface from './components/EnhancedSpotifyChatInterface';\n\n# Use with user context\n<EnhancedSpotifyChatInterface userId={currentUser.id} />\n```",
  "files_to_modify": [
    "src/"
  ],
  "implementation_steps": [
    "Review existing component structure",
    "Implement component improvements",
    "Add or update component tests",
    "Update component documentation"
  ],
  "complexity_score": 6,
  "implementation_plan": "## Implementation Plan for: 2. Integrate Enhanced Chat Interface\n```bash\n# Import the enhanced chat component\nimport EnhancedSpo...\n\n### Complexity Assessment\n- Complexity Score: 6/10\n- Estimated Duration: 45-60 minutes\n- Priority: medium\n\n### Target Files/Directories\n- src/\n\n### Implementation Steps\n1. Review existing component structure\n2. Implement component improvements\n3. Add or update component tests\n4. Update component documentation\n\n### Success Criteria\n- All implementation steps completed successfully\n- Code changes follow project standards\n- Appropriate tests added or updated\n- Documentation updated as needed\n\n### Risk Assessment\n- Complexity Level: Medium\n- Breaking Change Risk: Low\n- Testing Requirements: Standard",
  "status": "completed",
  "execution_time": "2025-08-23T21:51:58.248853",
  "estimated_duration": "45-60 minutes"
}