{
  "task_id": "roadmap_task_3",
  "title": "3. Spotify API Usage Patterns\n- **Optimize API request batching and caching** to reduce latency and ...",
  "description": "3. Spotify API Usage Patterns\n- **Optimize API request batching and caching** to reduce latency and improve rate limit handling (Priority: High).\n- **Expand Spotify integration** to support playlist...\n                \n                [Full research results in autonomous session: .autonomous-coding-session/research_cycle_1.md]",
  "files_to_modify": [
    "src/api/",
    "src/routes/",
    "src/endpoints/"
  ],
  "implementation_steps": [
    "Review API endpoint specifications",
    "Implement endpoint changes",
    "Add input validation and error handling",
    "Update API documentation",
    "Add endpoint tests"
  ],
  "complexity_score": 10,
  "implementation_plan": "## Implementation Plan for: 3. Spotify API Usage Patterns\n- **Optimize API request batching and caching** to reduce latency and ...\n\n### Complexity Assessment\n- Complexity Score: 10/10\n- Estimated Duration: 90-120 minutes\n- Priority: medium\n\n### Target Files/Directories\n- src/api/\n- src/routes/\n- src/endpoints/\n\n### Implementation Steps\n1. Review API endpoint specifications\n2. Implement endpoint changes\n3. Add input validation and error handling\n4. Update API documentation\n5. Add endpoint tests\n\n### Success Criteria\n- All implementation steps completed successfully\n- Code changes follow project standards\n- Appropriate tests added or updated\n- Documentation updated as needed\n\n### Risk Assessment\n- Complexity Level: High\n- Breaking Change Risk: High\n- Testing Requirements: Extensive",
  "status": "completed",
  "execution_time": "2025-08-26T12:43:31.245244",
  "estimated_duration": "90-120 minutes"
}