{
  "title": "EchoTune AI - Comprehensive Repository Research Report",
  "generatedAt": "2025-08-16T16:48:07.163Z",
  "researchMethodology": {
    "tools": [
      "Perplexity API",
      "Grok-4 Analysis",
      "Repository Analysis"
    ],
    "scope": "Full repository analysis with AI-powered insights",
    "timeframe": "Current state with 2025 best practices"
  },
  "executiveSummary": "EchoTune AI represents a sophisticated music discovery platform with advanced AI integration capabilities. \nThe current implementation demonstrates strong architectural foundations with comprehensive MCP server \nintegration, multi-provider AI orchestration, and robust security measures. Key strengths include \nthe extensive technology stack, real-time capabilities, and scalable infrastructure design.\n\nAreas for improvement include performance optimization, enhanced mobile experience, and expanded \nAI model integration. The platform is well-positioned for continued growth and innovation in the \nmusic discovery space.",
  "findings": {
    "repositoryAnalysis": {
      "packageInfo": {
        "name": "echotune-ai",
        "version": "2.1.0",
        "description": "EchoTune AI - Advanced music discovery platform with AI-powered recommendations, conversational music search, and comprehensive analytics",
        "main": "server.js",
        "scripts": {
          "start": "node server.js",
          "start:original": "node src/index.js",
          "start:root": "node index.js",
          "mcp-server": "cd mcp-server && npm start",
          "mcp-orchestrator": "node mcp-server/enhanced-mcp-orchestrator.js",
          "mcp-workflow": "node mcp-server/workflow-manager.js",
          "mcp-community": "node scripts/test-community-mcp-servers.js",
          "mcp-install": "node scripts/mcp-manager.js install",
          "mcp-health": "node scripts/mcp-manager.js health",
          "mcp-test": "node scripts/mcp-manager.js test",
          "mcp-report": "node scripts/mcp-manager.js report",
          "validate": "node scripts/comprehensive-validation-suite.js",
          "validate:quick": "node scripts/comprehensive-validation-suite.js --quick",
          "mcp:validate-connectivity": "./mcp-config/validate_mcp.sh",
          "mcp:package-mgmt": "node mcp-servers/package-management/package-version-mcp.js",
          "mcp:code-sandbox": "node mcp-servers/code-sandbox/code-sandbox-mcp.js",
          "mcp:analytics": "node mcp-servers/analytics-server/analytics-mcp.js",
          "mcp:testing": "node mcp-servers/testing-automation/testing-automation-mcp.js",
          "mcp:sentry": "node mcp-servers/sentry-mcp/sentry-mcp-server.js",
          "mcp:sentry-test": "node mcp-servers/sentry-mcp/test-sentry-mcp.js",
          "mcp:sentry-health": "curl -f http://localhost:3012/health || exit 1",
          "mcp:filesystem": "node mcp-servers/filesystem/index.js",
          "mcp:memory": "node mcp-servers/memory/index.js",
          "mcp:github-repos": "node mcp-servers/github-repos-manager/index.js",
          "mcp:brave-search": "node mcp-servers/brave-search/brave-search-mcp.js",
          "mcp:sequential-thinking": "node mcp-servers/sequential-thinking/dist/index.js",
          "mcp:browserbase": "node mcp-servers/browserbase/browserbase-mcp.js",
          "mcp:start:all": "cd mcp-servers && npm run start:all",
          "mcp:test:all": "npm run mcp:test:comprehensive && npm run mcp:test:live-servers && npm run mcp:test:automation",
          "mcp:validate:all": "node mcp-comprehensive-server-test.js --validate-only",
          "mcp:health:all": "curl -s http://localhost:3002/health | jq '.' || echo 'Orchestrator not running'",
          "mcp:orchestrated-start": "node mcp-server/enhanced-mcp-orchestrator.js --start-all",
          "mcp:orchestrator-health": "curl -s http://localhost:3002/servers | jq '.' || echo 'Orchestrator not available'",
          "mcp:discover": "node scripts/discover-new-mcp-servers.js",
          "mcp:auto-docs": "node scripts/mcp-documentation-automator.js",
          "mcp:full-automation": "npm run mcp:discover && npm run mcp:auto-docs",
          "mcp:test-automation": "node scripts/test-mcp-automation.js",
          "mcp:health-all": "npm run mcp:health && curl -f http://localhost:3002/health && curl -f http://localhost:3003/status",
          "mcp:validate-comprehensive": "node scripts/comprehensive-mcp-validation.js",
          "mcp:enhanced-validation": "node scripts/enhanced-mcp-validation-pipeline.js",
          "mcp:enhanced-validation-fix": "npm install && node scripts/enhanced-mcp-validation-pipeline.js",
          "mcp:test:comprehensive": "node scripts/mcp/comprehensive-test-suite.js",
          "mcp:test:live-servers": "node scripts/mcp/live-server-test.js",
          "mcp:test:automation": "node scripts/mcp/automation-progress-test.js",
          "mcp:orchestrator-status": "node mcp-server/enhanced-registry-orchestrator.js status",
          "mcp:orchestrator-start": "node mcp-server/enhanced-registry-orchestrator.js start",
          "mcp:health-monitor": "node mcp-server/enhanced-health-monitor.js",
          "mcp:continuous-monitor": "node scripts/continuous-mcp-monitor.js",
          "mcpperplexity": "node mcp-servers/perplexity-mcp/perplexity-mcp-server.js",
          "testperplexity": "node -e \"const server = require('./mcp-servers/perplexity-mcp/perplexity-mcp-server.js'); console.log('Perplexity MCP server test passed');\"",
          "test:perplexity-enhanced": "node mcp-servers/perplexity-mcp/test-enhanced-perplexity.js",
          "validate:perplexity-enhanced": "./mcp-servers/perplexity-mcp/validate-enhanced-perplexity.sh",
          "generate-cursor-mcp": "node scripts/generate-cursor-mcp-enhanced.js",
          "dev": "nodemon src/index.js",
          "dev:frontend": "vite",
          "build": "vite build",
          "build:frontend": "vite build",
          "preview": "vite preview",
          "test": "jest --config tests/jest.config.js",
          "test:watch": "jest --config tests/jest.config.js --watch",
          "test:integration": "jest --config tests/jest.config.js tests/integration",
          "test:unit": "jest --config tests/jest.config.js tests/unit",
          "test:e2e": "jest --config tests/jest.config.js tests/e2e",
          "test:performance": "jest --config tests/jest.config.js tests/performance",
          "test:mcp": "jest --config tests/jest.config.js tests/integration/enhanced-mcp-tools.test.js",
          "test:mcp-performance": "jest --config tests/jest.config.js tests/performance/mcp-performance.test.js",
          "test:mcp-integration": "./tests/mcp-integration.test.sh",
          "lint": "npx eslint src/",
          "lint:fix": "npx eslint src/ --fix",
          "format": "npx prettier --write src/",
          "format:check": "npx prettier --check src/",
          "health-check": "curl -f http://localhost:3000/health || exit 1",
          "deploy": "./scripts/deploy.sh",
          "deploy:simple": "./scripts/simple-deploy.sh deploy",
          "deploy:digitalocean": "node scripts/digitalocean-manager.js deploy",
          "deploy:doctl": "bash scripts/deployment/install-doctl-ghpat.sh",
          "deploy:doctl-demo": "bash scripts/deployment/install-doctl-ghpat.sh --dry-run",
          "deploy:doctl-test": "bash scripts/deployment/install-doctl-ghpat.sh --app-platform --debug",
          "deploy:doctl-monitor": "bash scripts/deployment/install-doctl-ghpat.sh monitor",
          "deploy:open": "echo 'Opening deployment page...' && xdg-open http://localhost:3000/deploy/ || echo 'Open http://localhost:3000/deploy/'",
          "deploy:page": "echo 'One-click deployment page: http://localhost:3000/deploy/'",
          "validate-deployment": "./validate-deployment.sh",
          "setup-digitalocean": "./scripts/deployment/setup-digitalocean.sh",
          "integrate-mcp": "./scripts/integrate-mcp.sh",
          "complete-integrations": "./scripts/complete-integrations.sh",
          "mcp-integrate": "node scripts/integrate-mcp-servers.js",
          "mcp-test-filesystem": "node node_modules/FileScopeMCP/dist/index.js --help",
          "mcp-test-browserbase": "node scripts/browserbase-test.js",
          "mcp-generate-diagrams": "node scripts/integrate-mcp-servers.js --diagrams-only",
          "mcp-analyze-repo": "node scripts/integrate-mcp-servers.js --analyze-only",
          "mcp-server-start": "cd mcp-server && npm run orchestrator",
          "mcp-test-integration": "node scripts/test-mcp-integration.js",
          "test:deployment": "./tests/deployment-core.test.sh",
          "validate:deployment": "./tests/deployment-core.test.sh && ./tests/mcp-integration.test.sh",
          "validate:scripts": "bash -n scripts/*.sh && bash -n *.sh",
          "validate:env": "node -e \"require('dotenv').config(); console.log('Environment validation passed')\"",
          "analyze:json-data": "node scripts/analyze-json-data.js",
          "merge:json-data": "node scripts/merge-json-data.js",
          "validate:merged-data": "node scripts/validate-merged-data.js",
          "data:complete-analysis": "npm run analyze:json-data && npm run merge:json-data && npm run validate:merged-data",
          "validate:comprehensive": "node scripts/comprehensive-validation.js",
          "validate:api-keys": "node scripts/validate-api-keys.js --all",
          "validate:api-comprehensive": "node scripts/comprehensive-api-testing.js",
          "validate:spotify": "node scripts/validate-api-keys.js --spotify",
          "validate:openai": "node scripts/validate-api-keys.js --openai",
          "validate:gemini": "node scripts/validate-api-keys.js --gemini",
          "validate:mongodb": "node scripts/validate-api-keys.js --mongodb",
          "validate:mongodb-comprehensive": "node scripts/validate-mongodb-connection.js",
          "validate:mongodb-enhanced": "node scripts/validate-enhanced-mongodb.js",
          "populate:spotify-analytics": "node scripts/populate-spotify-analytics.js",
          "process:enhanced-data": "node scripts/process-enhanced-data.js",
          "analyze:listening-history": "node scripts/analyze-listening-history-merge.js",
          "enhance:audio-features": "node scripts/enhance-audio-features.js",
          "diagnostic:data": "node scripts/data-diagnostic.js",
          "optimize:database-ai": "node scripts/optimize-database-ai.js",
          "fetch:missing-audio-features": "node scripts/fetch-missing-audio-features.js",
          "implement:feature-vectors": "node scripts/implement-feature-vectors.js",
          "status:redis-roadmap": "node scripts/redis-roadmap-status.js",
          "validate:mcp-server": "node scripts/validate-api-keys.js --mcp-server",
          "validate:security": "node scripts/validate-api-keys.js --security",
          "validate:ssl": "node scripts/validate-api-keys.js --ssl",
          "validate:docker": "node scripts/validate-api-keys.js --docker",
          "test:servers": "node scripts/test-all-servers.js",
          "test:docker-hub": "node scripts/test-all-servers.js && echo 'Testing Docker Hub specifically...'",
          "test:digitalocean": "node scripts/test-all-servers.js && echo 'Testing DigitalOcean services...'",
          "test:registries": "node scripts/test-all-servers.js && echo 'Testing all container registries...'",
          "auth:wizard": "node scripts/auth-wizard.js",
          "auth:setup": "node scripts/auth-wizard.js",
          "deployment:status": "node scripts/deployment-status.js",
          "deployment:report": "node scripts/deployment-status.js && cat DEPLOYMENT_STATUS_REPORT.md",
          "do:status": "node scripts/digitalocean-manager.js status",
          "do:apps": "node scripts/digitalocean-manager.js apps",
          "do:droplets": "node scripts/digitalocean-manager.js droplets",
          "do:registries": "node scripts/digitalocean-manager.js registries",
          "do:k8s": "node scripts/digitalocean-manager.js k8s",
          "do:docker-login": "node scripts/digitalocean-manager.js docker-login",
          "do:deploy": "node scripts/digitalocean-manager.js deploy",
          "do:report": "node scripts/digitalocean-manager.js report",
          "do:auth": "node scripts/digitalocean-manager.js auth",
          "do:enhanced": "node scripts/enhanced-digitalocean-manager.js",
          "do:enhanced-test": "node scripts/enhanced-digitalocean-manager.js test",
          "do:enhanced-auth": "node scripts/enhanced-digitalocean-manager.js auth",
          "do:enhanced-registry-token": "node scripts/enhanced-digitalocean-manager.js registry-token",
          "do:enhanced-account": "node scripts/enhanced-digitalocean-manager.js account",
          "do:enhanced-update-env": "node scripts/enhanced-digitalocean-manager.js update-env",
          "config:report": "node scripts/update-env-config.js",
          "config:add-missing": "node scripts/update-env-config.js --add-missing --backup",
          "config:interactive": "node scripts/update-env-config.js --interactive",
          "config:dry-run": "node scripts/update-env-config.js --add-missing --dry-run",
          "automate:mcp": "node scripts/mcp-automation.js",
          "automate:validate": "node scripts/mcp-automation.js validate",
          "automate:test": "node scripts/mcp-automation.js test",
          "automate:docs": "node scripts/mcp-automation.js docs",
          "automate:health": "node scripts/mcp-automation.js health",
          "automate:optimize": "node scripts/mcp-automation.js optimize",
          "automate:all": "node scripts/mcp-automation.js all",
          "automate:status": "node scripts/mcp-automation.js status",
          "automate:report": "node scripts/mcp-automation.js report",
          "validate:comprehensive-mcp": "node scripts/comprehensive-mcp-validation.js",
          "automate:enhanced": "node scripts/enhanced-mcp-automation.js",
          "validate:full-system": "node scripts/enhanced-mcp-automation.js",
          "mcp-health-check": "curl -s http://localhost:3001/health | jq '.' || echo 'MCP server not running'",
          "mcp:registry-orchestrator": "node mcp-server/enhanced-registry-orchestrator.js",
          "mcp:orchestrator-stop": "node mcp-server/enhanced-registry-orchestrator.js stop",
          "mcp:comprehensive-suite": "npm run mcp:enhanced-validation && npm run mcp:health-monitor &",
          "mcp-manage": "node scripts/mcp-manager.js",
          "mcp-test-all": "node scripts/mcp-manager.js test",
          "mcp-validate": "node scripts/validate-mcp-integration.js",
          "merge-csv": "python scripts/merge_csv_data.py",
          "setup-db": "python scripts/database_setup.py",
          "populate-audio": "python scripts/populate_audio_features.py",
          "migrate-mongodb": "python scripts/migrate_to_mongodb.py",
          "migrate-supabase": "python scripts/migrate_to_supabase.py",
          "mcp-spotify": "cd mcp-server && python spotify_server.py",
          "analyze-data": "python scripts/analyze_listening_data.py",
          "train-model": "python scripts/train_recommendation_model.py",
          "prompts": "node prompts/tools/cli.js",
          "prompts:validate": "node prompts/tools/validator.js validate",
          "prompts:execute": "node prompts/tools/executor.js execute",
          "prompts:test": "node prompts/tools/executor.js test",
          "prompts:list": "node prompts/tools/executor.js list",
          "prompts:fix": "node prompts/tools/validator.js fix",
          "prompts:server": "node prompts/tools/cli.js server",
          "perplexity:exec": "node prompts/tools/executor.js execute analysis/user-driven-sonar-pro --user_prompt",
          "gemini-test": "node scripts/test-gemini-integration.js",
          "gemini-health": "node scripts/test-gemini-integration.js",
          "test:gemini-integration": "node scripts/test-gemini-integration.js",
          "test:automation-integration": "node scripts/test-automation-integration.js",
          "test:perplexity-grok4": "npm run test:integration -- --testPathPattern=perplexity-grok4-integration-tests.js",
          "demo:automation": "node scripts/demo-automation-workflow.js",
          "status:automation": "node scripts/automation-system-status.js",
          "research:music": "node scripts/music-research-automation.js",
          "test:music-integration": "npm run test:integration -- --testPathPattern=music.*test",
          "production-check": "node scripts/production-readiness-orchestrator.js --production-check",
          "production-deploy": "./scripts/deploy-digitalocean.sh",
          "workflow:analyze": "node scripts/workflow-optimizer.js analyze",
          "workflow:optimize": "node scripts/workflow-optimizer.js optimize",
          "workflow:optimize:apply": "node scripts/workflow-optimizer.js optimize --apply",
          "workflow:status": "node agent-workflow/workflow-cli.js status",
          "workflow:report": "node scripts/workflow-optimizer.js report",
          "agent:run": "node scripts/continuous-agent.js",
          "agent:analyze": "node scripts/continuous-agent.js analyze",
          "agent:create-issue": "node scripts/continuous-agent.js create-issue",
          "agent:status": "node scripts/continuous-agent.js status",
          "agent:config": "cat agent-workflow/config/config.json",
          "agent:enable": "node -e \"const fs=require('fs'); const config=require('./agent-workflow/config/config.json'); config.enabled=true; fs.writeFileSync('./agent-workflow/config/config.json', JSON.stringify(config,null,2));\"",
          "agent:disable": "node -e \"const fs=require('fs'); const config=require('./agent-workflow/config/config.json'); config.enabled=false; fs.writeFileSync('./agent-workflow/config/config.json', JSON.stringify(config,null,2));\"",
          "workflow:templates": "node agent-workflow/workflow-cli.js templates",
          "workflow:create": "node agent-workflow/workflow-cli.js create",
          "workflow:active": "node agent-workflow/workflow-cli.js active",
          "workflow:validate": "node agent-workflow/workflow-cli.js validate",
          "workflow:generate": "node agent-workflow/workflow-cli.js generate",
          "workflow:cli": "node agent-workflow/workflow-cli.js",
          "validate:digitalocean": "./scripts/validate-digitalocean-deployment.sh",
          "validate:deployment-config": "./scripts/validate-digitalocean-deployment.sh",
          "docker:setup": "./scripts/docker/docker-ubuntu-setup.sh",
          "docker:deploy": "./scripts/simple-deploy.sh",
          "docker:manage": "./scripts/docker/docker-manager.sh",
          "docker:optimize": "./scripts/docker/docker-manager.sh optimize",
          "docker:monitor": "./scripts/docker/docker-manager.sh monitor",
          "docker:check": "./scripts/docker/docker-manager.sh check",
          "docker:report": "./scripts/docker/docker-manager.sh report",
          "deploy:docker": "./scripts/simple-deploy.sh deploy",
          "deploy:ubuntu": "./scripts/docker/docker-ubuntu-setup.sh && ./scripts/simple-deploy.sh",
          "setup:redis": "node scripts/setup-redis.js",
          "configure:redis": "node scripts/configure-redis.js",
          "validate:redis": "node -e \"const redis = require('./src/utils/redis-manager'); redis.ping().then(() => {console.log('✅ Redis connected'); return redis.close();}).catch(e => {console.error('❌ Redis failed:', e.message); process.exit(1);}).finally(() => process.exit(0))\"",
          "redis:health": "node -e \"const RedisManager = require('./scripts/configure-redis'); const r = new RedisManager(); r.initialize().then(() => r.healthCheck()).then(h => console.log(JSON.stringify(h, null, 2))).finally(() => r.close())\"",
          "redis:stats": "node -e \"const RedisManager = require('./scripts/configure-redis'); const r = new RedisManager(); r.initialize().then(() => r.getCacheStats()).then(s => console.log(JSON.stringify(s, null, 2))).finally(() => r.close())\"",
          "redis:clear": "node -e \"const RedisManager = require('./scripts/configure-redis'); const r = new RedisManager(); r.initialize().then(() => r.clearCache()).then(() => console.log('✅ Cache cleared')).finally(() => r.close())\"",
          "redis:clear-audio": "node -e \"const RedisManager = require('./scripts/configure-redis'); const r = new RedisManager(); r.initialize().then(() => r.clearCache('audio_features:*')).then(count => console.log('✅ Cleared', count, 'audio features')).finally(() => r.close())\"",
          "redis:clear-recommendations": "node -e \"const RedisManager = require('./scripts/configure-redis'); const r = new RedisManager(); r.initialize().then(() => r.clearCache('recommendations:*')).then(count => console.log('✅ Cleared', count, 'recommendations')).finally(() => r.close())\"",
          "performance:baseline": "node src/utils/performance-baseline.js",
          "performance:smoke-test": "node scripts/performance-smoke-test.js",
          "performance:mcp-analytics": "node -e \"const {MCPPerformanceAnalytics} = require('./src/utils/mcp-performance-analytics'); const analytics = new MCPPerformanceAnalytics(); analytics.runAnalytics().catch(console.error);\"",
          "test:performance-smoke": "npm run performance:smoke-test -- --duration 30",
          "security:audit": "./scripts/security-audit.sh",
          "security:check": "npm audit && ./scripts/security-audit.sh",
          "production:validate": "./scripts/security-audit.sh && npm audit --audit-level=high",
          "production:ready": "npm run lint && npm run test && npm run security:audit && npm run build",
          "mcp:n8n_mcp": "node mcp-servers/new-candidates/n8n-mcp/integration.js",
          "test:n8n_mcp": "jest mcp-servers/new-candidates/n8n-mcp/test.js",
          "mcp:mcp_server_code_runner": "node mcp-servers/new-candidates/mcp-server-code-runner/integration.js",
          "test:mcp_server_code_runner": "jest mcp-servers/new-candidates/mcp-server-code-runner/test.js",
          "mcp:mongodb_mcp_server": "node mcp-servers/new-candidates/mongodb-mcp-server/integration.js",
          "test:mongodb_mcp_server": "jest mcp-servers/new-candidates/mongodb-mcp-server/test.js",
          "mcp:puppeteer_mcp_server": "node mcp-servers/new-candidates/puppeteer-mcp-server/integration.js",
          "test:puppeteer_mcp_server": "jest mcp-servers/new-candidates/puppeteer-mcp-server/test.js",
          "mcp:hismaserver_puppeteer": "node mcp-servers/new-candidates/@hisma/server-puppeteer/integration.js",
          "test:hismaserver_puppeteer": "jest mcp-servers/new-candidates/@hisma/server-puppeteer/test.js",
          "mcp:candidates": "node scripts/run-all-candidates.js",
          "test:candidates": "jest mcp-servers/new-candidates/*/test.js",
          "enhanced-mcp:start": "node src/mcp/enhanced-multimodel-orchestrator.js",
          "enhanced-mcp:workflow": "node src/mcp/workflow-integration-manager.js",
          "enhanced-mcp:test": "node -e \"const WorkflowManager = require('./src/mcp/workflow-integration-manager'); const manager = new WorkflowManager(); console.log('Enhanced MCP system initialized successfully');\"",
          "enhanced-mcp:health": "curl -s http://localhost:3000/api/enhanced-mcp/health | jq '.' || echo 'Enhanced MCP server not running'",
          "enhanced-mcp:capabilities": "curl -s http://localhost:3000/api/enhanced-mcp/capabilities | jq '.' || echo 'Enhanced MCP server not running'",
          "enhanced-mcp:models": "curl -s http://localhost:3000/api/enhanced-mcp/models | jq '.' || echo 'Enhanced MCP server not running'",
          "production-readiness": "node scripts/production-readiness-analyzer.js",
          "production-automation": "node scripts/mcp-production-automation.js",
          "production-analysis": "node scripts/production-readiness-orchestrator.js",
          "production-analysis:quick": "node scripts/production-readiness-orchestrator.js --quick",
          "production-analysis:full": "node scripts/production-readiness-orchestrator.js --full",
          "production-fixes": "npm run lint:fix && npm audit fix && npm run format",
          "production-ready": "npm run production-analysis && echo 'Check PRODUCTION_READINESS_EXECUTIVE_SUMMARY.md for results'",
          "mcp:health:n8n": "node scripts/mcp/probes/probe-n8n.js",
          "mcp:health:mongodb": "node scripts/mcp/probes/probe-mongodb.js",
          "mcp:validate-all": "node validate-all-mcp-servers.js"
        },
        "keywords": [
          "music-discovery",
          "music-recommendations",
          "spotify-integration",
          "ai-music-chat",
          "music-analytics",
          "conversational-ai",
          "music-platform",
          "playlist-generation"
        ],
        "author": "EchoTune AI Team",
        "license": "MIT",
        "repository": {
          "type": "git",
          "url": "https://github.com/dzp5103/Spotify-echo.git"
        },
        "bugs": {
          "url": "https://github.com/dzp5103/Spotify-echo/issues"
        },
        "homepage": "https://github.com/dzp5103/Spotify-echo#readme",
        "engines": {
          "node": ">=20.0.0",
          "npm": ">=10.0.0",
          "python": ">=3.8"
        },
        "dependencies": {
          "@babel/preset-react": "^7.27.1",
          "@browserbasehq/mcp-server-browserbase": "github:browserbase/mcp-server-browserbase",
          "@emotion/react": "^11.14.0",
          "@emotion/styled": "^11.14.1",
          "@google/generative-ai": "^0.2.1",
          "@hisma/server-puppeteer": "^0.6.5",
          "@modelcontextprotocol/sdk": "^1.17.3",
          "@modelcontextprotocol/server-filesystem": "^2025.7.29",
          "@modelcontextprotocol/server-memory": "^2025.8.4",
          "@modelcontextprotocol/server-puppeteer": "^2025.5.12",
          "@modelcontextprotocol/server-sequential-thinking": "^2025.7.1",
          "@mui/icons-material": "^7.3.1",
          "@mui/material": "^7.3.1",
          "@mui/system": "^7.3.1",
          "@octokit/rest": "^22.0.0",
          "@sentry/node": "^10.3.0",
          "@supabase/supabase-js": "^2.53.0",
          "ajv": "^8.12.0",
          "ajv-formats": "^2.1.1",
          "better-sqlite3": "^12.2.0",
          "commander": "^12.0.0",
          "compression": "^1.7.4",
          "cookie-parser": "^1.4.7",
          "cors": "^2.8.5",
          "csv-parser": "^3.2.0",
          "express": "^4.18.0",
          "express-rate-limit": "^7.1.5",
          "express-session": "^1.18.2",
          "express-slow-down": "^2.0.1",
          "FileScopeMCP": "github:admica/FileScopeMCP",
          "glob": "^11.0.3",
          "helmet": "^7.1.0",
          "js-yaml": "^4.1.0",
          "jsonwebtoken": "^9.0.2",
          "lodash": "^4.17.21",
          "mcp-server-code-runner": "^0.1.7",
          "mongodb-mcp-server": "^0.2.0",
          "multer": "^2.0.0",
          "n8n-mcp": "^2.10.2",
          "node-cache": "^5.1.2",
          "node-fetch": "^3.3.2",
          "openai": "^4.24.0",
          "prop-types": "^15.8.1",
          "puppeteer-mcp-server": "^0.7.2",
          "react": "^19.1.1",
          "react-dom": "^19.1.1",
          "react-router-dom": "^7.7.1",
          "redis": "^4.7.1",
          "socket.io": "^4.7.0",
          "socket.io-client": "^4.8.1",
          "sqlite3": "^5.1.7",
          "uuid": "^9.0.1",
          "ws": "^8.14.0"
        },
        "devDependencies": {
          "@azure/openai": "^2.0.0",
          "@babel/core": "^7.28.0",
          "@babel/plugin-transform-modules-commonjs": "^7.27.1",
          "@babel/preset-env": "^7.28.0",
          "@eslint/js": "^9.33.0",
          "@types/cors": "^2.8.0",
          "@types/express": "^4.17.0",
          "@types/jest": "^29.0.0",
          "@types/multer": "^1.4.0",
          "@types/node": "^20.0.0",
          "@typescript-eslint/eslint-plugin": "^6.0.0",
          "@typescript-eslint/parser": "^6.0.0",
          "@vitejs/plugin-react": "^4.7.0",
          "autoprefixer": "^10.4.21",
          "axios": "^1.11.0",
          "babel-jest": "^30.0.5",
          "concurrently": "^9.2.0",
          "dotenv": "^16.6.1",
          "eslint": "^8.0.0",
          "eslint-config-prettier": "^9.0.0",
          "eslint-plugin-prettier": "^5.0.0",
          "eslint-plugin-react": "^7.37.5",
          "eslint-plugin-react-hooks": "^5.2.0",
          "globals": "^16.3.0",
          "jest": "^29.7.0",
          "jest-environment-jsdom": "^30.0.5",
          "mongodb": "^6.18.0",
          "nodemon": "^3.0.0",
          "postcss": "^8.5.6",
          "prettier": "^3.0.0",
          "puppeteer": "^24.16.2",
          "supertest": "^7.1.4",
          "swagger-jsdoc": "^6.2.8",
          "swagger-ui-express": "^5.0.1",
          "terser": "^5.43.1",
          "ts-jest": "^29.0.0",
          "typescript": "^5.0.0",
          "vite": "^7.0.6",
          "vite-plugin-compression": "^0.5.1",
          "web-vitals": "^3.5.2",
          "webpack": "^5.0.0",
          "webpack-cli": "^5.0.0"
        },
        "mcp": {
          "servers": {
            "browser": {
              "command": "npx",
              "args": [
                "@modelcontextprotocol/server-puppeteer"
              ],
              "env": {
                "PUPPETEER_HEADLESS": "true"
              }
            },
            "browserbase": {
              "command": "npx",
              "args": [
                "@browserbasehq/mcp-server-browserbase"
              ],
              "env": {
                "BROWSERBASE_API_KEY": "${BROWSERBASE_API_KEY}",
                "BROWSERBASE_PROJECT_ID": "${BROWSERBASE_PROJECT_ID}"
              }
            },
            "filesystem": {
              "command": "node",
              "args": [
                "node_modules/FileScopeMCP/dist/mcp-server.js"
              ],
              "env": {
                "ALLOWED_DIRECTORIES": "${PWD},${PWD}/src,${PWD}/scripts,${PWD}/mcp-server"
              }
            },
            "spotify": {
              "command": "python",
              "args": [
                "mcp-server/spotify_server.py"
              ],
              "env": {
                "SPOTIFY_CLIENT_ID": "${SPOTIFY_CLIENT_ID}",
                "SPOTIFY_CLIENT_SECRET": "${SPOTIFY_CLIENT_SECRET}"
              }
            },
            "sequential-thinking": {
              "command": "node",
              "args": [
                "mcp-servers/sequential-thinking/dist/index.js"
              ],
              "description": "Structured thinking and reasoning capabilities for complex tasks"
            },
            "screenshot-website": {
              "command": "node",
              "args": [
                "mcp-servers/screenshot-website/dist/index.js"
              ],
              "description": "Fast website screenshot capabilities for automation"
            },
            "enhanced-file-utilities": {
              "command": "node",
              "args": [
                "mcp-servers/enhanced-file-utilities.js"
              ],
              "description": "Enhanced file handling with validation and security"
            },
            "enhanced-browser-tools": {
              "command": "node",
              "args": [
                "mcp-servers/enhanced-browser-tools.js"
              ],
              "description": "Improved browser automation with error checking"
            },
            "comprehensive-validator": {
              "command": "node",
              "args": [
                "mcp-servers/comprehensive-validator.js"
              ],
              "description": "System-wide validation and monitoring"
            }
          }
        },
        "jest": {
          "testEnvironment": "jsdom",
          "setupFilesAfterEnv": [
            "<rootDir>/tests/setup.js"
          ],
          "testMatch": [
            "**/__tests__/**/*.test.{js,ts}",
            "**/tests/**/*.test.{js,ts}"
          ],
          "collectCoverageFrom": [
            "src/**/*.{js,ts}",
            "!src/**/*.d.ts"
          ],
          "coverageDirectory": "coverage",
          "coverageReporters": [
            "text",
            "lcov",
            "html"
          ],
          "moduleNameMapper": {
            "^@/(.*)$": "<rootDir>/src/$1"
          },
          "transform": {
            "^.+\\.js$": "babel-jest"
          },
          "transformIgnorePatterns": [
            "node_modules/(?!(mongodb|bson)/)"
          ]
        },
        "eslintConfig": {
          "extends": [
            "eslint:recommended",
            "plugin:react/recommended",
            "plugin:react-hooks/recommended"
          ],
          "plugins": [
            "react",
            "react-hooks"
          ],
          "env": {
            "node": true,
            "browser": true,
            "es2021": true,
            "jest": true
          },
          "parserOptions": {
            "ecmaVersion": 2021,
            "sourceType": "module",
            "ecmaFeatures": {
              "jsx": true
            }
          },
          "settings": {
            "react": {
              "version": "detect"
            }
          },
          "rules": {
            "no-unused-vars": [
              "error",
              {
                "argsIgnorePattern": "^_",
                "varsIgnorePattern": "^_"
              }
            ],
            "no-console": "off",
            "semi": [
              "error",
              "always"
            ],
            "quotes": [
              "error",
              "single"
            ],
            "react/react-in-jsx-scope": "off",
            "react/jsx-uses-react": "off",
            "react/prop-types": "off"
          },
          "overrides": [
            {
              "files": [
                "src/mobile/mobile-responsive.js",
                "src/security/security-manager.js",
                "src/utils/performance-manager.js"
              ],
              "env": {
                "browser": true,
                "node": true
              }
            },
            {
              "files": [
                "**/*.jsx",
                "**/*.tsx"
              ],
              "rules": {
                "react/react-in-jsx-scope": "off"
              }
            }
          ]
        },
        "prettier": {
          "semi": true,
          "trailingComma": "es5",
          "singleQuote": true,
          "printWidth": 100,
          "tabWidth": 2
        }
      },
      "structure": [
        "./validation-reports/comprehensive-validation-1755347567054.md",
        "./validation-reports/comprehensive-validation-1755354166280.md",
        "./validation-reports/comprehensive-validation-2025-08-16T10-19-31-002Z.json",
        "./validation-reports/linting-fixes-1755354875811.json",
        "./validation-reports/validation-summary-2025-08-16T10-19-31-002Z.md",
        "./validation-reports/validation-summary-2025-08-16T10-07-04-901Z.md",
        "./validation-reports/comprehensive-validation-1755347567053.json",
        "./validation-reports/comprehensive-validation-1755354166275.json",
        "./validation-reports/comprehensive-validation-2025-08-16T10-07-04-901Z.json",
        "./enhanced-perplexity-results/enhanced-perplexity-test-grok4-2025-08-16T10-16-40-664Z.json",
        "./enhanced-perplexity-results/enhanced-perplexity-comprehensive-2025-08-16T12-29-27-453Z.json",
        "./enhanced-perplexity-results/enhanced-perplexity-multi-research-2025-08-16T14-25-17-970Z.json",
        "./enhanced-perplexity-results/enhanced-perplexity-analyze-repo-2025-08-16T14-24-01-220Z.json",
        "./enhanced-perplexity-grok4-integration.js",
        "./Connect to cursor.pdf",
        "./DEPLOYMENT.md",
        "./integrate-mcp-workflows.js",
        "./search-results/repo-analysis-1755335045128.json",
        "./search-results/search-1755334998412.json",
        "./search-results/multi-search-1755335090978.json",
        "./requirements-production.txt",
        "./env.example (6).txt",
        "./ROADMAP_AUTO.md",
        "./INTEGRATION_COMPLETE_REPORT.md",
        "./MCP_SERVERS_INTEGRATION_GUIDE.md",
        "./api-testing-results.json",
        "./scripts/test-all-servers.js",
        "./scripts/fix-redis-url.js",
        "./scripts/implement-new-mcp-candidates.js",
        "./scripts/status-heartbeat.js",
        "./scripts/analyze-automation-scripts.js",
        "./scripts/integrate-mcp.sh",
        "./scripts/ci/run-tests.sh",
        "./scripts/ci/setup.sh",
        "./scripts/demo-automation-workflow.js",
        "./scripts/enhance-audio-features.js",
        "./scripts/test-mcp-automation.js",
        "./scripts/analyze-missing-data.js",
        "./scripts/test-comprehensive-mcp-integration.js",
        "./scripts/mcp/logs.sh",
        "./scripts/mcp/probes/probe-n8n.js",
        "./scripts/mcp/probes/probe-mongodb.js",
        "./scripts/mcp/healthcheck.sh",
        "./scripts/mcp/comprehensive-test-suite.js",
        "./scripts/mcp/automation-progress-test.js",
        "./scripts/mcp/run.sh",
        "./scripts/mcp/down.sh",
        "./scripts/mcp/live-server-test.js",
        "./scripts/mcp/up.sh",
        "./scripts/mcp/guards/require-prod-approval.sh"
      ],
      "analysis": {
        "content": "Mock response for: Analyze this Node.js project structure for EchoTune AI music discovery platform:\n\nPackage.json: {\n  \"name\": \"echotune-ai\",\n  \"version\": \"2.1.0\",\n  \"description\": \"EchoTune AI - Advanced music discovery platform with AI-powered recommendations, conversational music search, and comprehensive analytics\",\n  \"main\": \"server.js\",\n  \"scripts\": {\n    \"start\": \"node server.js\",\n    \"start:original\": \"node src/index.js\",\n    \"start:root\": \"node index.js\",\n    \"mcp-server\": \"cd mcp-server && npm start\",\n    \"mcp-orchestrator\": \"node mcp-server/enhanced-mcp-orchestrator.js\",\n    \"mcp-workflow\": \"node mcp-server/workflow-manager.js\",\n    \"mcp-community\": \"node scripts/test-community-mcp-servers.js\",\n    \"mcp-install\": \"node scripts/mcp-manager.js install\",\n    \"mcp-health\": \"node scripts/mcp-manager.js health\",\n    \"mcp-test\": \"node scripts/mcp-manager.js test\",\n    \"mcp-report\": \"node scripts/mcp-manager.js report\",\n    \"validate\": \"node scripts/comprehensive-validation-suite.js\",\n    \"validate:quick\": \"node scripts/comprehensive-validation-suite.js --quick\",\n    \"mcp:validate-connectivity\": \"./mcp-config/validate_mcp.sh\",\n    \"mcp:package-mgmt\": \"node mcp-servers/package-management/package-version-mcp.js\",\n    \"mcp:code-sandbox\": \"node mcp-servers/code-sandbox/code-sandbox-mcp.js\",\n    \"mcp:analytics\": \"node mcp-servers/analytics-server/analytics-mcp.js\",\n    \"mcp:testing\": \"node mcp-servers/testing-automation/testing-automation-mcp.js\",\n    \"mcp:sentry\": \"node mcp-servers/sentry-mcp/sentry-mcp-server.js\",\n    \"mcp:sentry-test\": \"node mcp-servers/sentry-mcp/test-sentry-mcp.js\",\n    \"mcp:sentry-health\": \"curl -f http://localhost:3012/health || exit 1\",\n    \"mcp:filesystem\": \"node mcp-servers/filesystem/index.js\",\n    \"mcp:memory\": \"node mcp-servers/memory/index.js\",\n    \"mcp:github-repos\": \"node mcp-servers/github-repos-manager/index.js\",\n    \"mcp:brave-search\": \"node mcp-servers/brave-search/brave-search-mcp.js\",\n    \"mcp:sequential-thinking\": \"node mcp-servers/sequential-thinking/dist/index.js\",\n    \"mcp:browserbase\": \"node mcp-servers/browserbase/browserbase-mcp.js\",\n    \"mcp:start:all\": \"cd mcp-servers && npm run start:all\",\n    \"mcp:test:all\": \"npm run mcp:test:comprehensive && npm run mcp:test:live-servers && npm run mcp:test:automation\",\n    \"mcp:validate:all\": \"node mcp-comprehensive-server-test.js --validate-only\",\n    \"mcp:health:all\": \"curl -s http://localhost:3002/health | jq '.' || echo 'Orchestrator not running'\",\n    \"mcp:orchestrated-start\": \"node mcp-server/enhanced-mcp-orchestrator.js --start-all\",\n    \"mcp:orchestrator-health\": \"curl -s http://localhost:3002/servers | jq '.' || echo 'Orchestrator not available'\",\n    \"mcp:discover\": \"node scripts/discover-new-mcp-servers.js\",\n    \"mcp:auto-docs\": \"node scripts/mcp-documentation-automator.js\",\n    \"mcp:full-automation\": \"npm run mcp:discover && npm run mcp:auto-docs\",\n    \"mcp:test-automation\": \"node scripts/test-mcp-automation.js\",\n    \"mcp:health-all\": \"npm run mcp:health && curl -f http://localhost:3002/health && curl -f http://localhost:3003/status\",\n    \"mcp:validate-comprehensive\": \"node scripts/comprehensive-mcp-validation.js\",\n    \"mcp:enhanced-validation\": \"node scripts/enhanced-mcp-validation-pipeline.js\",\n    \"mcp:enhanced-validation-fix\": \"npm install && node scripts/enhanced-mcp-validation-pipeline.js\",\n    \"mcp:test:comprehensive\": \"node scripts/mcp/comprehensive-test-suite.js\",\n    \"mcp:test:live-servers\": \"node scripts/mcp/live-server-test.js\",\n    \"mcp:test:automation\": \"node scripts/mcp/automation-progress-test.js\",\n    \"mcp:orchestrator-status\": \"node mcp-server/enhanced-registry-orchestrator.js status\",\n    \"mcp:orchestrator-start\": \"node mcp-server/enhanced-registry-orchestrator.js start\",\n    \"mcp:health-monitor\": \"node mcp-server/enhanced-health-monitor.js\",\n    \"mcp:continuous-monitor\": \"node scripts/continuous-mcp-monitor.js\",\n    \"mcpperplexity\": \"node mcp-servers/perplexity-mcp/perplexity-mcp-server.js\",\n    \"testperplexity\": \"node -e \\\"const server = require('./mcp-servers/perplexity-mcp/perplexity-mcp-server.js'); console.log('Perplexity MCP server test passed');\\\"\",\n    \"test:perplexity-enhanced\": \"node mcp-servers/perplexity-mcp/test-enhanced-perplexity.js\",\n    \"validate:perplexity-enhanced\": \"./mcp-servers/perplexity-mcp/validate-enhanced-perplexity.sh\",\n    \"generate-cursor-mcp\": \"node scripts/generate-cursor-mcp-enhanced.js\",\n    \"dev\": \"nodemon src/index.js\",\n    \"dev:frontend\": \"vite\",\n    \"build\": \"vite build\",\n    \"build:frontend\": \"vite build\",\n    \"preview\": \"vite preview\",\n    \"test\": \"jest --config tests/jest.config.js\",\n    \"test:watch\": \"jest --config tests/jest.config.js --watch\",\n    \"test:integration\": \"jest --config tests/jest.config.js tests/integration\",\n    \"test:unit\": \"jest --config tests/jest.config.js tests/unit\",\n    \"test:e2e\": \"jest --config tests/jest.config.js tests/e2e\",\n    \"test:performance\": \"jest --config tests/jest.config.js tests/performance\",\n    \"test:mcp\": \"jest --config tests/jest.config.js tests/integration/enhanced-mcp-tools.test.js\",\n    \"test:mcp-performance\": \"jest --config tests/jest.config.js tests/performance/mcp-performance.test.js\",\n    \"test:mcp-integration\": \"./tests/mcp-integration.test.sh\",\n    \"lint\": \"npx eslint src/\",\n    \"lint:fix\": \"npx eslint src/ --fix\",\n    \"format\": \"npx prettier --write src/\",\n    \"format:check\": \"npx prettier --check src/\",\n    \"health-check\": \"curl -f http://localhost:3000/health || exit 1\",\n    \"deploy\": \"./scripts/deploy.sh\",\n    \"deploy:simple\": \"./scripts/simple-deploy.sh deploy\",\n    \"deploy:digitalocean\": \"node scripts/digitalocean-manager.js deploy\",\n    \"deploy:doctl\": \"bash scripts/deployment/install-doctl-ghpat.sh\",\n    \"deploy:doctl-demo\": \"bash scripts/deployment/install-doctl-ghpat.sh --dry-run\",\n    \"deploy:doctl-test\": \"bash scripts/deployment/install-doctl-ghpat.sh --app-platform --debug\",\n    \"deploy:doctl-monitor\": \"bash scripts/deployment/install-doctl-ghpat.sh monitor\",\n    \"deploy:open\": \"echo 'Opening deployment page...' && xdg-open http://localhost:3000/deploy/ || echo 'Open http://localhost:3000/deploy/'\",\n    \"deploy:page\": \"echo 'One-click deployment page: http://localhost:3000/deploy/'\",\n    \"validate-deployment\": \"./validate-deployment.sh\",\n    \"setup-digitalocean\": \"./scripts/deployment/setup-digitalocean.sh\",\n    \"integrate-mcp\": \"./scripts/integrate-mcp.sh\",\n    \"complete-integrations\": \"./scripts/complete-integrations.sh\",\n    \"mcp-integrate\": \"node scripts/integrate-mcp-servers.js\",\n    \"mcp-test-filesystem\": \"node node_modules/FileScopeMCP/dist/index.js --help\",\n    \"mcp-test-browserbase\": \"node scripts/browserbase-test.js\",\n    \"mcp-generate-diagrams\": \"node scripts/integrate-mcp-servers.js --diagrams-only\",\n    \"mcp-analyze-repo\": \"node scripts/integrate-mcp-servers.js --analyze-only\",\n    \"mcp-server-start\": \"cd mcp-server && npm run orchestrator\",\n    \"mcp-test-integration\": \"node scripts/test-mcp-integration.js\",\n    \"test:deployment\": \"./tests/deployment-core.test.sh\",\n    \"validate:deployment\": \"./tests/deployment-core.test.sh && ./tests/mcp-integration.test.sh\",\n    \"validate:scripts\": \"bash -n scripts/*.sh && bash -n *.sh\",\n    \"validate:env\": \"node -e \\\"require('dotenv').config(); console.log('Environment validation passed')\\\"\",\n    \"analyze:json-data\": \"node scripts/analyze-json-data.js\",\n    \"merge:json-data\": \"node scripts/merge-json-data.js\",\n    \"validate:merged-data\": \"node scripts/validate-merged-data.js\",\n    \"data:complete-analysis\": \"npm run analyze:json-data && npm run merge:json-data && npm run validate:merged-data\",\n    \"validate:comprehensive\": \"node scripts/comprehensive-validation.js\",\n    \"validate:api-keys\": \"node scripts/validate-api-keys.js --all\",\n    \"validate:api-comprehensive\": \"node scripts/comprehensive-api-testing.js\",\n    \"validate:spotify\": \"node scripts/validate-api-keys.js --spotify\",\n    \"validate:openai\": \"node scripts/validate-api-keys.js --openai\",\n    \"validate:gemini\": \"node scripts/validate-api-keys.js --gemini\",\n    \"validate:mongodb\": \"node scripts/validate-api-keys.js --mongodb\",\n    \"validate:mongodb-comprehensive\": \"node scripts/validate-mongodb-connection.js\",\n    \"validate:mongodb-enhanced\": \"node scripts/validate-enhanced-mongodb.js\",\n    \"populate:spotify-analytics\": \"node scripts/populate-spotify-analytics.js\",\n    \"process:enhanced-data\": \"node scripts/process-enhanced-data.js\",\n    \"analyze:listening-history\": \"node scripts/analyze-listening-history-merge.js\",\n    \"enhance:audio-features\": \"node scripts/enhance-audio-features.js\",\n    \"diagnostic:data\": \"node scripts/data-diagnostic.js\",\n    \"optimize:database-ai\": \"node scripts/optimize-database-ai.js\",\n    \"fetch:missing-audio-features\": \"node scripts/fetch-missing-audio-features.js\",\n    \"implement:feature-vectors\": \"node scripts/implement-feature-vectors.js\",\n    \"status:redis-roadmap\": \"node scripts/redis-roadmap-status.js\",\n    \"validate:mcp-server\": \"node scripts/validate-api-keys.js --mcp-server\",\n    \"validate:security\": \"node scripts/validate-api-keys.js --security\",\n    \"validate:ssl\": \"node scripts/validate-api-keys.js --ssl\",\n    \"validate:docker\": \"node scripts/validate-api-keys.js --docker\",\n    \"test:servers\": \"node scripts/test-all-servers.js\",\n    \"test:docker-hub\": \"node scripts/test-all-servers.js && echo 'Testing Docker Hub specifically...'\",\n    \"test:digitalocean\": \"node scripts/test-all-servers.js && echo 'Testing DigitalOcean services...'\",\n    \"test:registries\": \"node scripts/test-all-servers.js && echo 'Testing all container registries...'\",\n    \"auth:wizard\": \"node scripts/auth-wizard.js\",\n    \"auth:setup\": \"node scripts/auth-wizard.js\",\n    \"deployment:status\": \"node scripts/deployment-status.js\",\n    \"deployment:report\": \"node scripts/deployment-status.js && cat DEPLOYMENT_STATUS_REPORT.md\",\n    \"do:status\": \"node scripts/digitalocean-manager.js status\",\n    \"do:apps\": \"node scripts/digitalocean-manager.js apps\",\n    \"do:droplets\": \"node scripts/digitalocean-manager.js droplets\",\n    \"do:registries\": \"node scripts/digitalocean-manager.js registries\",\n    \"do:k8s\": \"node scripts/digitalocean-manager.js k8s\",\n    \"do:docker-login\": \"node scripts/digitalocean-manager.js docker-login\",\n    \"do:deploy\": \"node scripts/digitalocean-manager.js deploy\",\n    \"do:report\": \"node scripts/digitalocean-manager.js report\",\n    \"do:auth\": \"node scripts/digitalocean-manager.js auth\",\n    \"do:enhanced\": \"node scripts/enhanced-digitalocean-manager.js\",\n    \"do:enhanced-test\": \"node scripts/enhanced-digitalocean-manager.js test\",\n    \"do:enhanced-auth\": \"node scripts/enhanced-digitalocean-manager.js auth\",\n    \"do:enhanced-registry-token\": \"node scripts/enhanced-digitalocean-manager.js registry-token\",\n    \"do:enhanced-account\": \"node scripts/enhanced-digitalocean-manager.js account\",\n    \"do:enhanced-update-env\": \"node scripts/enhanced-digitalocean-manager.js update-env\",\n    \"config:report\": \"node scripts/update-env-config.js\",\n    \"config:add-missing\": \"node scripts/update-env-config.js --add-missing --backup\",\n    \"config:interactive\": \"node scripts/update-env-config.js --interactive\",\n    \"config:dry-run\": \"node scripts/update-env-config.js --add-missing --dry-run\",\n    \"automate:mcp\": \"node scripts/mcp-automation.js\",\n    \"automate:validate\": \"node scripts/mcp-automation.js validate\",\n    \"automate:test\": \"node scripts/mcp-automation.js test\",\n    \"automate:docs\": \"node scripts/mcp-automation.js docs\",\n    \"automate:health\": \"node scripts/mcp-automation.js health\",\n    \"automate:optimize\": \"node scripts/mcp-automation.js optimize\",\n    \"automate:all\": \"node scripts/mcp-automation.js all\",\n    \"automate:status\": \"node scripts/mcp-automation.js status\",\n    \"automate:report\": \"node scripts/mcp-automation.js report\",\n    \"validate:comprehensive-mcp\": \"node scripts/comprehensive-mcp-validation.js\",\n    \"automate:enhanced\": \"node scripts/enhanced-mcp-automation.js\",\n    \"validate:full-system\": \"node scripts/enhanced-mcp-automation.js\",\n    \"mcp-health-check\": \"curl -s http://localhost:3001/health | jq '.' || echo 'MCP server not running'\",\n    \"mcp:registry-orchestrator\": \"node mcp-server/enhanced-registry-orchestrator.js\",\n    \"mcp:orchestrator-stop\": \"node mcp-server/enhanced-registry-orchestrator.js stop\",\n    \"mcp:comprehensive-suite\": \"npm run mcp:enhanced-validation && npm run mcp:health-monitor &\",\n    \"mcp-manage\": \"node scripts/mcp-manager.js\",\n    \"mcp-test-all\": \"node scripts/mcp-manager.js test\",\n    \"mcp-validate\": \"node scripts/validate-mcp-integration.js\",\n    \"merge-csv\": \"python scripts/merge_csv_data.py\",\n    \"setup-db\": \"python scripts/database_setup.py\",\n    \"populate-audio\": \"python scripts/populate_audio_features.py\",\n    \"migrate-mongodb\": \"python scripts/migrate_to_mongodb.py\",\n    \"migrate-supabase\": \"python scripts/migrate_to_supabase.py\",\n    \"mcp-spotify\": \"cd mcp-server && python spotify_server.py\",\n    \"analyze-data\": \"python scripts/analyze_listening_data.py\",\n    \"train-model\": \"python scripts/train_recommendation_model.py\",\n    \"prompts\": \"node prompts/tools/cli.js\",\n    \"prompts:validate\": \"node prompts/tools/validator.js validate\",\n    \"prompts:execute\": \"node prompts/tools/executor.js execute\",\n    \"prompts:test\": \"node prompts/tools/executor.js test\",\n    \"prompts:list\": \"node prompts/tools/executor.js list\",\n    \"prompts:fix\": \"node prompts/tools/validator.js fix\",\n    \"prompts:server\": \"node prompts/tools/cli.js server\",\n    \"perplexity:exec\": \"node prompts/tools/executor.js execute analysis/user-driven-sonar-pro --user_prompt\",\n    \"gemini-test\": \"node scripts/test-gemini-integration.js\",\n    \"gemini-health\": \"node scripts/test-gemini-integration.js\",\n    \"test:gemini-integration\": \"node scripts/test-gemini-integration.js\",\n    \"test:automation-integration\": \"node scripts/test-automation-integration.js\",\n    \"test:perplexity-grok4\": \"npm run test:integration -- --testPathPattern=perplexity-grok4-integration-tests.js\",\n    \"demo:automation\": \"node scripts/demo-automation-workflow.js\",\n    \"status:automation\": \"node scripts/automation-system-status.js\",\n    \"research:music\": \"node scripts/music-research-automation.js\",\n    \"test:music-integration\": \"npm run test:integration -- --testPathPattern=music.*test\",\n    \"production-check\": \"node scripts/production-readiness-orchestrator.js --production-check\",\n    \"production-deploy\": \"./scripts/deploy-digitalocean.sh\",\n    \"workflow:analyze\": \"node scripts/workflow-optimizer.js analyze\",\n    \"workflow:optimize\": \"node scripts/workflow-optimizer.js optimize\",\n    \"workflow:optimize:apply\": \"node scripts/workflow-optimizer.js optimize --apply\",\n    \"workflow:status\": \"node agent-workflow/workflow-cli.js status\",\n    \"workflow:report\": \"node scripts/workflow-optimizer.js report\",\n    \"agent:run\": \"node scripts/continuous-agent.js\",\n    \"agent:analyze\": \"node scripts/continuous-agent.js analyze\",\n    \"agent:create-issue\": \"node scripts/continuous-agent.js create-issue\",\n    \"agent:status\": \"node scripts/continuous-agent.js status\",\n    \"agent:config\": \"cat agent-workflow/config/config.json\",\n    \"agent:enable\": \"node -e \\\"const fs=require('fs'); const config=require('./agent-workflow/config/config.json'); config.enabled=true; fs.writeFileSync('./agent-workflow/config/config.json', JSON.stringify(config,null,2));\\\"\",\n    \"agent:disable\": \"node -e \\\"const fs=require('fs'); const config=require('./agent-workflow/config/config.json'); config.enabled=false; fs.writeFileSync('./agent-workflow/config/config.json', JSON.stringify(config,null,2));\\\"\",\n    \"workflow:templates\": \"node agent-workflow/workflow-cli.js templates\",\n    \"workflow:create\": \"node agent-workflow/workflow-cli.js create\",\n    \"workflow:active\": \"node agent-workflow/workflow-cli.js active\",\n    \"workflow:validate\": \"node agent-workflow/workflow-cli.js validate\",\n    \"workflow:generate\": \"node agent-workflow/workflow-cli.js generate\",\n    \"workflow:cli\": \"node agent-workflow/workflow-cli.js\",\n    \"validate:digitalocean\": \"./scripts/validate-digitalocean-deployment.sh\",\n    \"validate:deployment-config\": \"./scripts/validate-digitalocean-deployment.sh\",\n    \"docker:setup\": \"./scripts/docker/docker-ubuntu-setup.sh\",\n    \"docker:deploy\": \"./scripts/simple-deploy.sh\",\n    \"docker:manage\": \"./scripts/docker/docker-manager.sh\",\n    \"docker:optimize\": \"./scripts/docker/docker-manager.sh optimize\",\n    \"docker:monitor\": \"./scripts/docker/docker-manager.sh monitor\",\n    \"docker:check\": \"./scripts/docker/docker-manager.sh check\",\n    \"docker:report\": \"./scripts/docker/docker-manager.sh report\",\n    \"deploy:docker\": \"./scripts/simple-deploy.sh deploy\",\n    \"deploy:ubuntu\": \"./scripts/docker/docker-ubuntu-setup.sh && ./scripts/simple-deploy.sh\",\n    \"setup:redis\": \"node scripts/setup-redis.js\",\n    \"configure:redis\": \"node scripts/configure-redis.js\",\n    \"validate:redis\": \"node -e \\\"const redis = require('./src/utils/redis-manager'); redis.ping().then(() => {console.log('✅ Redis connected'); return redis.close();}).catch(e => {console.error('❌ Redis failed:', e.message); process.exit(1);}).finally(() => process.exit(0))\\\"\",\n    \"redis:health\": \"node -e \\\"const RedisManager = require('./scripts/configure-redis'); const r = new RedisManager(); r.initialize().then(() => r.healthCheck()).then(h => console.log(JSON.stringify(h, null, 2))).finally(() => r.close())\\\"\",\n    \"redis:stats\": \"node -e \\\"const RedisManager = require('./scripts/configure-redis'); const r = new RedisManager(); r.initialize().then(() => r.getCacheStats()).then(s => console.log(JSON.stringify(s, null, 2))).finally(() => r.close())\\\"\",\n    \"redis:clear\": \"node -e \\\"const RedisManager = require('./scripts/configure-redis'); const r = new RedisManager(); r.initialize().then(() => r.clearCache()).then(() => console.log('✅ Cache cleared')).finally(() => r.close())\\\"\",\n    \"redis:clear-audio\": \"node -e \\\"const RedisManager = require('./scripts/configure-redis'); const r = new RedisManager(); r.initialize().then(() => r.clearCache('audio_features:*')).then(count => console.log('✅ Cleared', count, 'audio features')).finally(() => r.close())\\\"\",\n    \"redis:clear-recommendations\": \"node -e \\\"const RedisManager = require('./scripts/configure-redis'); const r = new RedisManager(); r.initialize().then(() => r.clearCache('recommendations:*')).then(count => console.log('✅ Cleared', count, 'recommendations')).finally(() => r.close())\\\"\",\n    \"performance:baseline\": \"node src/utils/performance-baseline.js\",\n    \"performance:smoke-test\": \"node scripts/performance-smoke-test.js\",\n    \"performance:mcp-analytics\": \"node -e \\\"const {MCPPerformanceAnalytics} = require('./src/utils/mcp-performance-analytics'); const analytics = new MCPPerformanceAnalytics(); analytics.runAnalytics().catch(console.error);\\\"\",\n    \"test:performance-smoke\": \"npm run performance:smoke-test -- --duration 30\",\n    \"security:audit\": \"./scripts/security-audit.sh\",\n    \"security:check\": \"npm audit && ./scripts/security-audit.sh\",\n    \"production:validate\": \"./scripts/security-audit.sh && npm audit --audit-level=high\",\n    \"production:ready\": \"npm run lint && npm run test && npm run security:audit && npm run build\",\n    \"mcp:n8n_mcp\": \"node mcp-servers/new-candidates/n8n-mcp/integration.js\",\n    \"test:n8n_mcp\": \"jest mcp-servers/new-candidates/n8n-mcp/test.js\",\n    \"mcp:mcp_server_code_runner\": \"node mcp-servers/new-candidates/mcp-server-code-runner/integration.js\",\n    \"test:mcp_server_code_runner\": \"jest mcp-servers/new-candidates/mcp-server-code-runner/test.js\",\n    \"mcp:mongodb_mcp_server\": \"node mcp-servers/new-candidates/mongodb-mcp-server/integration.js\",\n    \"test:mongodb_mcp_server\": \"jest mcp-servers/new-candidates/mongodb-mcp-server/test.js\",\n    \"mcp:puppeteer_mcp_server\": \"node mcp-servers/new-candidates/puppeteer-mcp-server/integration.js\",\n    \"test:puppeteer_mcp_server\": \"jest mcp-servers/new-candidates/puppeteer-mcp-server/test.js\",\n    \"mcp:hismaserver_puppeteer\": \"node mcp-servers/new-candidates/@hisma/server-puppeteer/integration.js\",\n    \"test:hismaserver_puppeteer\": \"jest mcp-servers/new-candidates/@hisma/server-puppeteer/test.js\",\n    \"mcp:candidates\": \"node scripts/run-all-candidates.js\",\n    \"test:candidates\": \"jest mcp-servers/new-candidates/*/test.js\",\n    \"enhanced-mcp:start\": \"node src/mcp/enhanced-multimodel-orchestrator.js\",\n    \"enhanced-mcp:workflow\": \"node src/mcp/workflow-integration-manager.js\",\n    \"enhanced-mcp:test\": \"node -e \\\"const WorkflowManager = require('./src/mcp/workflow-integration-manager'); const manager = new WorkflowManager(); console.log('Enhanced MCP system initialized successfully');\\\"\",\n    \"enhanced-mcp:health\": \"curl -s http://localhost:3000/api/enhanced-mcp/health | jq '.' || echo 'Enhanced MCP server not running'\",\n    \"enhanced-mcp:capabilities\": \"curl -s http://localhost:3000/api/enhanced-mcp/capabilities | jq '.' || echo 'Enhanced MCP server not running'\",\n    \"enhanced-mcp:models\": \"curl -s http://localhost:3000/api/enhanced-mcp/models | jq '.' || echo 'Enhanced MCP server not running'\",\n    \"production-readiness\": \"node scripts/production-readiness-analyzer.js\",\n    \"production-automation\": \"node scripts/mcp-production-automation.js\",\n    \"production-analysis\": \"node scripts/production-readiness-orchestrator.js\",\n    \"production-analysis:quick\": \"node scripts/production-readiness-orchestrator.js --quick\",\n    \"production-analysis:full\": \"node scripts/production-readiness-orchestrator.js --full\",\n    \"production-fixes\": \"npm run lint:fix && npm audit fix && npm run format\",\n    \"production-ready\": \"npm run production-analysis && echo 'Check PRODUCTION_READINESS_EXECUTIVE_SUMMARY.md for results'\",\n    \"mcp:health:n8n\": \"node scripts/mcp/probes/probe-n8n.js\",\n    \"mcp:health:mongodb\": \"node scripts/mcp/probes/probe-mongodb.js\",\n    \"mcp:validate-all\": \"node validate-all-mcp-servers.js\"\n  },\n  \"keywords\": [\n    \"music-discovery\",\n    \"music-recommendations\",\n    \"spotify-integration\",\n    \"ai-music-chat\",\n    \"music-analytics\",\n    \"conversational-ai\",\n    \"music-platform\",\n    \"playlist-generation\"\n  ],\n  \"author\": \"EchoTune AI Team\",\n  \"license\": \"MIT\",\n  \"repository\": {\n    \"type\": \"git\",\n    \"url\": \"https://github.com/dzp5103/Spotify-echo.git\"\n  },\n  \"bugs\": {\n    \"url\": \"https://github.com/dzp5103/Spotify-echo/issues\"\n  },\n  \"homepage\": \"https://github.com/dzp5103/Spotify-echo#readme\",\n  \"engines\": {\n    \"node\": \">=20.0.0\",\n    \"npm\": \">=10.0.0\",\n    \"python\": \">=3.8\"\n  },\n  \"dependencies\": {\n    \"@babel/preset-react\": \"^7.27.1\",\n    \"@browserbasehq/mcp-server-browserbase\": \"github:browserbase/mcp-server-browserbase\",\n    \"@emotion/react\": \"^11.14.0\",\n    \"@emotion/styled\": \"^11.14.1\",\n    \"@google/generative-ai\": \"^0.2.1\",\n    \"@hisma/server-puppeteer\": \"^0.6.5\",\n    \"@modelcontextprotocol/sdk\": \"^1.17.3\",\n    \"@modelcontextprotocol/server-filesystem\": \"^2025.7.29\",\n    \"@modelcontextprotocol/server-memory\": \"^2025.8.4\",\n    \"@modelcontextprotocol/server-puppeteer\": \"^2025.5.12\",\n    \"@modelcontextprotocol/server-sequential-thinking\": \"^2025.7.1\",\n    \"@mui/icons-material\": \"^7.3.1\",\n    \"@mui/material\": \"^7.3.1\",\n    \"@mui/system\": \"^7.3.1\",\n    \"@octokit/rest\": \"^22.0.0\",\n    \"@sentry/node\": \"^10.3.0\",\n    \"@supabase/supabase-js\": \"^2.53.0\",\n    \"ajv\": \"^8.12.0\",\n    \"ajv-formats\": \"^2.1.1\",\n    \"better-sqlite3\": \"^12.2.0\",\n    \"commander\": \"^12.0.0\",\n    \"compression\": \"^1.7.4\",\n    \"cookie-parser\": \"^1.4.7\",\n    \"cors\": \"^2.8.5\",\n    \"csv-parser\": \"^3.2.0\",\n    \"express\": \"^4.18.0\",\n    \"express-rate-limit\": \"^7.1.5\",\n    \"express-session\": \"^1.18.2\",\n    \"express-slow-down\": \"^2.0.1\",\n    \"FileScopeMCP\": \"github:admica/FileScopeMCP\",\n    \"glob\": \"^11.0.3\",\n    \"helmet\": \"^7.1.0\",\n    \"js-yaml\": \"^4.1.0\",\n    \"jsonwebtoken\": \"^9.0.2\",\n    \"lodash\": \"^4.17.21\",\n    \"mcp-server-code-runner\": \"^0.1.7\",\n    \"mongodb-mcp-server\": \"^0.2.0\",\n    \"multer\": \"^2.0.0\",\n    \"n8n-mcp\": \"^2.10.2\",\n    \"node-cache\": \"^5.1.2\",\n    \"node-fetch\": \"^3.3.2\",\n    \"openai\": \"^4.24.0\",\n    \"prop-types\": \"^15.8.1\",\n    \"puppeteer-mcp-server\": \"^0.7.2\",\n    \"react\": \"^19.1.1\",\n    \"react-dom\": \"^19.1.1\",\n    \"react-router-dom\": \"^7.7.1\",\n    \"redis\": \"^4.7.1\",\n    \"socket.io\": \"^4.7.0\",\n    \"socket.io-client\": \"^4.8.1\",\n    \"sqlite3\": \"^5.1.7\",\n    \"uuid\": \"^9.0.1\",\n    \"ws\": \"^8.14.0\"\n  },\n  \"devDependencies\": {\n    \"@azure/openai\": \"^2.0.0\",\n    \"@babel/core\": \"^7.28.0\",\n    \"@babel/plugin-transform-modules-commonjs\": \"^7.27.1\",\n    \"@babel/preset-env\": \"^7.28.0\",\n    \"@eslint/js\": \"^9.33.0\",\n    \"@types/cors\": \"^2.8.0\",\n    \"@types/express\": \"^4.17.0\",\n    \"@types/jest\": \"^29.0.0\",\n    \"@types/multer\": \"^1.4.0\",\n    \"@types/node\": \"^20.0.0\",\n    \"@typescript-eslint/eslint-plugin\": \"^6.0.0\",\n    \"@typescript-eslint/parser\": \"^6.0.0\",\n    \"@vitejs/plugin-react\": \"^4.7.0\",\n    \"autoprefixer\": \"^10.4.21\",\n    \"axios\": \"^1.11.0\",\n    \"babel-jest\": \"^30.0.5\",\n    \"concurrently\": \"^9.2.0\",\n    \"dotenv\": \"^16.6.1\",\n    \"eslint\": \"^8.0.0\",\n    \"eslint-config-prettier\": \"^9.0.0\",\n    \"eslint-plugin-prettier\": \"^5.0.0\",\n    \"eslint-plugin-react\": \"^7.37.5\",\n    \"eslint-plugin-react-hooks\": \"^5.2.0\",\n    \"globals\": \"^16.3.0\",\n    \"jest\": \"^29.7.0\",\n    \"jest-environment-jsdom\": \"^30.0.5\",\n    \"mongodb\": \"^6.18.0\",\n    \"nodemon\": \"^3.0.0\",\n    \"postcss\": \"^8.5.6\",\n    \"prettier\": \"^3.0.0\",\n    \"puppeteer\": \"^24.16.2\",\n    \"supertest\": \"^7.1.4\",\n    \"swagger-jsdoc\": \"^6.2.8\",\n    \"swagger-ui-express\": \"^5.0.1\",\n    \"terser\": \"^5.43.1\",\n    \"ts-jest\": \"^29.0.0\",\n    \"typescript\": \"^5.0.0\",\n    \"vite\": \"^7.0.6\",\n    \"vite-plugin-compression\": \"^0.5.1\",\n    \"web-vitals\": \"^3.5.2\",\n    \"webpack\": \"^5.0.0\",\n    \"webpack-cli\": \"^5.0.0\"\n  },\n  \"mcp\": {\n    \"servers\": {\n      \"browser\": {\n        \"command\": \"npx\",\n        \"args\": [\n          \"@modelcontextprotocol/server-puppeteer\"\n        ],\n        \"env\": {\n          \"PUPPETEER_HEADLESS\": \"true\"\n        }\n      },\n      \"browserbase\": {\n        \"command\": \"npx\",\n        \"args\": [\n          \"@browserbasehq/mcp-server-browserbase\"\n        ],\n        \"env\": {\n          \"BROWSERBASE_API_KEY\": \"${BROWSERBASE_API_KEY}\",\n          \"BROWSERBASE_PROJECT_ID\": \"${BROWSERBASE_PROJECT_ID}\"\n        }\n      },\n      \"filesystem\": {\n        \"command\": \"node\",\n        \"args\": [\n          \"node_modules/FileScopeMCP/dist/mcp-server.js\"\n        ],\n        \"env\": {\n          \"ALLOWED_DIRECTORIES\": \"${PWD},${PWD}/src,${PWD}/scripts,${PWD}/mcp-server\"\n        }\n      },\n      \"spotify\": {\n        \"command\": \"python\",\n        \"args\": [\n          \"mcp-server/spotify_server.py\"\n        ],\n        \"env\": {\n          \"SPOTIFY_CLIENT_ID\": \"${SPOTIFY_CLIENT_ID}\",\n          \"SPOTIFY_CLIENT_SECRET\": \"${SPOTIFY_CLIENT_SECRET}\"\n        }\n      },\n      \"sequential-thinking\": {\n        \"command\": \"node\",\n        \"args\": [\n          \"mcp-servers/sequential-thinking/dist/index.js\"\n        ],\n        \"description\": \"Structured thinking and reasoning capabilities for complex tasks\"\n      },\n      \"screenshot-website\": {\n        \"command\": \"node\",\n        \"args\": [\n          \"mcp-servers/screenshot-website/dist/index.js\"\n        ],\n        \"description\": \"Fast website screenshot capabilities for automation\"\n      },\n      \"enhanced-file-utilities\": {\n        \"command\": \"node\",\n        \"args\": [\n          \"mcp-servers/enhanced-file-utilities.js\"\n        ],\n        \"description\": \"Enhanced file handling with validation and security\"\n      },\n      \"enhanced-browser-tools\": {\n        \"command\": \"node\",\n        \"args\": [\n          \"mcp-servers/enhanced-browser-tools.js\"\n        ],\n        \"description\": \"Improved browser automation with error checking\"\n      },\n      \"comprehensive-validator\": {\n        \"command\": \"node\",\n        \"args\": [\n          \"mcp-servers/comprehensive-validator.js\"\n        ],\n        \"description\": \"System-wide validation and monitoring\"\n      }\n    }\n  },\n  \"jest\": {\n    \"testEnvironment\": \"jsdom\",\n    \"setupFilesAfterEnv\": [\n      \"<rootDir>/tests/setup.js\"\n    ],\n    \"testMatch\": [\n      \"**/__tests__/**/*.test.{js,ts}\",\n      \"**/tests/**/*.test.{js,ts}\"\n    ],\n    \"collectCoverageFrom\": [\n      \"src/**/*.{js,ts}\",\n      \"!src/**/*.d.ts\"\n    ],\n    \"coverageDirectory\": \"coverage\",\n    \"coverageReporters\": [\n      \"text\",\n      \"lcov\",\n      \"html\"\n    ],\n    \"moduleNameMapper\": {\n      \"^@/(.*)$\": \"<rootDir>/src/$1\"\n    },\n    \"transform\": {\n      \"^.+\\\\.js$\": \"babel-jest\"\n    },\n    \"transformIgnorePatterns\": [\n      \"node_modules/(?!(mongodb|bson)/)\"\n    ]\n  },\n  \"eslintConfig\": {\n    \"extends\": [\n      \"eslint:recommended\",\n      \"plugin:react/recommended\",\n      \"plugin:react-hooks/recommended\"\n    ],\n    \"plugins\": [\n      \"react\",\n      \"react-hooks\"\n    ],\n    \"env\": {\n      \"node\": true,\n      \"browser\": true,\n      \"es2021\": true,\n      \"jest\": true\n    },\n    \"parserOptions\": {\n      \"ecmaVersion\": 2021,\n      \"sourceType\": \"module\",\n      \"ecmaFeatures\": {\n        \"jsx\": true\n      }\n    },\n    \"settings\": {\n      \"react\": {\n        \"version\": \"detect\"\n      }\n    },\n    \"rules\": {\n      \"no-unused-vars\": [\n        \"error\",\n        {\n          \"argsIgnorePattern\": \"^_\",\n          \"varsIgnorePattern\": \"^_\"\n        }\n      ],\n      \"no-console\": \"off\",\n      \"semi\": [\n        \"error\",\n        \"always\"\n      ],\n      \"quotes\": [\n        \"error\",\n        \"single\"\n      ],\n      \"react/react-in-jsx-scope\": \"off\",\n      \"react/jsx-uses-react\": \"off\",\n      \"react/prop-types\": \"off\"\n    },\n    \"overrides\": [\n      {\n        \"files\": [\n          \"src/mobile/mobile-responsive.js\",\n          \"src/security/security-manager.js\",\n          \"src/utils/performance-manager.js\"\n        ],\n        \"env\": {\n          \"browser\": true,\n          \"node\": true\n        }\n      },\n      {\n        \"files\": [\n          \"**/*.jsx\",\n          \"**/*.tsx\"\n        ],\n        \"rules\": {\n          \"react/react-in-jsx-scope\": \"off\"\n        }\n      }\n    ]\n  },\n  \"prettier\": {\n    \"semi\": true,\n    \"trailingComma\": \"es5\",\n    \"singleQuote\": true,\n    \"printWidth\": 100,\n    \"tabWidth\": 2\n  }\n}\n\nDirectory structure: [\n  \"./validation-reports/comprehensive-validation-1755347567054.md\",\n  \"./validation-reports/comprehensive-validation-1755354166280.md\",\n  \"./validation-reports/comprehensive-validation-2025-08-16T10-19-31-002Z.json\",\n  \"./validation-reports/linting-fixes-1755354875811.json\",\n  \"./validation-reports/validation-summary-2025-08-16T10-19-31-002Z.md\",\n  \"./validation-reports/validation-summary-2025-08-16T10-07-04-901Z.md\",\n  \"./validation-reports/comprehensive-validation-1755347567053.json\",\n  \"./validation-reports/comprehensive-validation-1755354166275.json\",\n  \"./validation-reports/comprehensive-validation-2025-08-16T10-07-04-901Z.json\",\n  \"./enhanced-perplexity-results/enhanced-perplexity-test-grok4-2025-08-16T10-16-40-664Z.json\",\n  \"./enhanced-perplexity-results/enhanced-perplexity-comprehensive-2025-08-16T12-29-27-453Z.json\",\n  \"./enhanced-perplexity-results/enhanced-perplexity-multi-research-2025-08-16T14-25-17-970Z.json\",\n  \"./enhanced-perplexity-results/enhanced-perplexity-analyze-repo-2025-08-16T14-24-01-220Z.json\",\n  \"./enhanced-perplexity-grok4-integration.js\",\n  \"./Connect to cursor.pdf\",\n  \"./DEPLOYMENT.md\",\n  \"./integrate-mcp-workflows.js\",\n  \"./search-results/repo-analysis-1755335045128.json\",\n  \"./search-results/search-1755334998412.json\",\n  \"./search-results/multi-search-1755335090978.json\",\n  \"./requirements-production.txt\",\n  \"./env.example (6).txt\",\n  \"./ROADMAP_AUTO.md\",\n  \"./INTEGRATION_COMPLETE_REPORT.md\",\n  \"./MCP_SERVERS_INTEGRATION_GUIDE.md\",\n  \"./api-testing-results.json\",\n  \"./scripts/test-all-servers.js\",\n  \"./scripts/fix-redis-url.js\",\n  \"./scripts/implement-new-mcp-candidates.js\",\n  \"./scripts/status-heartbeat.js\",\n  \"./scripts/analyze-automation-scripts.js\",\n  \"./scripts/integrate-mcp.sh\",\n  \"./scripts/ci/run-tests.sh\",\n  \"./scripts/ci/setup.sh\",\n  \"./scripts/demo-automation-workflow.js\",\n  \"./scripts/enhance-audio-features.js\",\n  \"./scripts/test-mcp-automation.js\",\n  \"./scripts/analyze-missing-data.js\",\n  \"./scripts/test-comprehensive-mcp-integration.js\",\n  \"./scripts/mcp/logs.sh\",\n  \"./scripts/mcp/probes/probe-n8n.js\",\n  \"./scripts/mcp/probes/probe-mongodb.js\",\n  \"./scripts/mcp/healthcheck.sh\",\n  \"./scripts/mcp/comprehensive-test-suite.js\",\n  \"./scripts/mcp/automation-progress-test.js\",\n  \"./scripts/mcp/run.sh\",\n  \"./scripts/mcp/down.sh\",\n  \"./scripts/mcp/live-server-test.js\",\n  \"./scripts/mcp/up.sh\",\n  \"./scripts/mcp/guards/require-prod-approval.sh\"\n]\n\nPlease provide:\n1. Project architecture assessment\n2. Technology stack evaluation\n3. Scalability considerations\n4. Security assessment\n5. Performance optimization opportunities\n\nThis is a simulated Perplexity API response. To get real results, configure PERPLEXITY_API_KEY environment variable.\n\nKey findings:\n- Analysis of Analyze this Node.js project structure for EchoTune AI music discovery platform:\n\nPackage.json: {\n  \"name\": \"echotune-ai\",\n  \"version\": \"2.1.0\",\n  \"description\": \"EchoTune AI - Advanced music discovery platform with AI-powered recommendations, conversational music search, and comprehensive analytics\",\n  \"main\": \"server.js\",\n  \"scripts\": {\n    \"start\": \"node server.js\",\n    \"start:original\": \"node src/index.js\",\n    \"start:root\": \"node index.js\",\n    \"mcp-server\": \"cd mcp-server && npm start\",\n    \"mcp-orchestrator\": \"node mcp-server/enhanced-mcp-orchestrator.js\",\n    \"mcp-workflow\": \"node mcp-server/workflow-manager.js\",\n    \"mcp-community\": \"node scripts/test-community-mcp-servers.js\",\n    \"mcp-install\": \"node scripts/mcp-manager.js install\",\n    \"mcp-health\": \"node scripts/mcp-manager.js health\",\n    \"mcp-test\": \"node scripts/mcp-manager.js test\",\n    \"mcp-report\": \"node scripts/mcp-manager.js report\",\n    \"validate\": \"node scripts/comprehensive-validation-suite.js\",\n    \"validate:quick\": \"node scripts/comprehensive-validation-suite.js --quick\",\n    \"mcp:validate-connectivity\": \"./mcp-config/validate_mcp.sh\",\n    \"mcp:package-mgmt\": \"node mcp-servers/package-management/package-version-mcp.js\",\n    \"mcp:code-sandbox\": \"node mcp-servers/code-sandbox/code-sandbox-mcp.js\",\n    \"mcp:analytics\": \"node mcp-servers/analytics-server/analytics-mcp.js\",\n    \"mcp:testing\": \"node mcp-servers/testing-automation/testing-automation-mcp.js\",\n    \"mcp:sentry\": \"node mcp-servers/sentry-mcp/sentry-mcp-server.js\",\n    \"mcp:sentry-test\": \"node mcp-servers/sentry-mcp/test-sentry-mcp.js\",\n    \"mcp:sentry-health\": \"curl -f http://localhost:3012/health || exit 1\",\n    \"mcp:filesystem\": \"node mcp-servers/filesystem/index.js\",\n    \"mcp:memory\": \"node mcp-servers/memory/index.js\",\n    \"mcp:github-repos\": \"node mcp-servers/github-repos-manager/index.js\",\n    \"mcp:brave-search\": \"node mcp-servers/brave-search/brave-search-mcp.js\",\n    \"mcp:sequential-thinking\": \"node mcp-servers/sequential-thinking/dist/index.js\",\n    \"mcp:browserbase\": \"node mcp-servers/browserbase/browserbase-mcp.js\",\n    \"mcp:start:all\": \"cd mcp-servers && npm run start:all\",\n    \"mcp:test:all\": \"npm run mcp:test:comprehensive && npm run mcp:test:live-servers && npm run mcp:test:automation\",\n    \"mcp:validate:all\": \"node mcp-comprehensive-server-test.js --validate-only\",\n    \"mcp:health:all\": \"curl -s http://localhost:3002/health | jq '.' || echo 'Orchestrator not running'\",\n    \"mcp:orchestrated-start\": \"node mcp-server/enhanced-mcp-orchestrator.js --start-all\",\n    \"mcp:orchestrator-health\": \"curl -s http://localhost:3002/servers | jq '.' || echo 'Orchestrator not available'\",\n    \"mcp:discover\": \"node scripts/discover-new-mcp-servers.js\",\n    \"mcp:auto-docs\": \"node scripts/mcp-documentation-automator.js\",\n    \"mcp:full-automation\": \"npm run mcp:discover && npm run mcp:auto-docs\",\n    \"mcp:test-automation\": \"node scripts/test-mcp-automation.js\",\n    \"mcp:health-all\": \"npm run mcp:health && curl -f http://localhost:3002/health && curl -f http://localhost:3003/status\",\n    \"mcp:validate-comprehensive\": \"node scripts/comprehensive-mcp-validation.js\",\n    \"mcp:enhanced-validation\": \"node scripts/enhanced-mcp-validation-pipeline.js\",\n    \"mcp:enhanced-validation-fix\": \"npm install && node scripts/enhanced-mcp-validation-pipeline.js\",\n    \"mcp:test:comprehensive\": \"node scripts/mcp/comprehensive-test-suite.js\",\n    \"mcp:test:live-servers\": \"node scripts/mcp/live-server-test.js\",\n    \"mcp:test:automation\": \"node scripts/mcp/automation-progress-test.js\",\n    \"mcp:orchestrator-status\": \"node mcp-server/enhanced-registry-orchestrator.js status\",\n    \"mcp:orchestrator-start\": \"node mcp-server/enhanced-registry-orchestrator.js start\",\n    \"mcp:health-monitor\": \"node mcp-server/enhanced-health-monitor.js\",\n    \"mcp:continuous-monitor\": \"node scripts/continuous-mcp-monitor.js\",\n    \"mcpperplexity\": \"node mcp-servers/perplexity-mcp/perplexity-mcp-server.js\",\n    \"testperplexity\": \"node -e \\\"const server = require('./mcp-servers/perplexity-mcp/perplexity-mcp-server.js'); console.log('Perplexity MCP server test passed');\\\"\",\n    \"test:perplexity-enhanced\": \"node mcp-servers/perplexity-mcp/test-enhanced-perplexity.js\",\n    \"validate:perplexity-enhanced\": \"./mcp-servers/perplexity-mcp/validate-enhanced-perplexity.sh\",\n    \"generate-cursor-mcp\": \"node scripts/generate-cursor-mcp-enhanced.js\",\n    \"dev\": \"nodemon src/index.js\",\n    \"dev:frontend\": \"vite\",\n    \"build\": \"vite build\",\n    \"build:frontend\": \"vite build\",\n    \"preview\": \"vite preview\",\n    \"test\": \"jest --config tests/jest.config.js\",\n    \"test:watch\": \"jest --config tests/jest.config.js --watch\",\n    \"test:integration\": \"jest --config tests/jest.config.js tests/integration\",\n    \"test:unit\": \"jest --config tests/jest.config.js tests/unit\",\n    \"test:e2e\": \"jest --config tests/jest.config.js tests/e2e\",\n    \"test:performance\": \"jest --config tests/jest.config.js tests/performance\",\n    \"test:mcp\": \"jest --config tests/jest.config.js tests/integration/enhanced-mcp-tools.test.js\",\n    \"test:mcp-performance\": \"jest --config tests/jest.config.js tests/performance/mcp-performance.test.js\",\n    \"test:mcp-integration\": \"./tests/mcp-integration.test.sh\",\n    \"lint\": \"npx eslint src/\",\n    \"lint:fix\": \"npx eslint src/ --fix\",\n    \"format\": \"npx prettier --write src/\",\n    \"format:check\": \"npx prettier --check src/\",\n    \"health-check\": \"curl -f http://localhost:3000/health || exit 1\",\n    \"deploy\": \"./scripts/deploy.sh\",\n    \"deploy:simple\": \"./scripts/simple-deploy.sh deploy\",\n    \"deploy:digitalocean\": \"node scripts/digitalocean-manager.js deploy\",\n    \"deploy:doctl\": \"bash scripts/deployment/install-doctl-ghpat.sh\",\n    \"deploy:doctl-demo\": \"bash scripts/deployment/install-doctl-ghpat.sh --dry-run\",\n    \"deploy:doctl-test\": \"bash scripts/deployment/install-doctl-ghpat.sh --app-platform --debug\",\n    \"deploy:doctl-monitor\": \"bash scripts/deployment/install-doctl-ghpat.sh monitor\",\n    \"deploy:open\": \"echo 'Opening deployment page...' && xdg-open http://localhost:3000/deploy/ || echo 'Open http://localhost:3000/deploy/'\",\n    \"deploy:page\": \"echo 'One-click deployment page: http://localhost:3000/deploy/'\",\n    \"validate-deployment\": \"./validate-deployment.sh\",\n    \"setup-digitalocean\": \"./scripts/deployment/setup-digitalocean.sh\",\n    \"integrate-mcp\": \"./scripts/integrate-mcp.sh\",\n    \"complete-integrations\": \"./scripts/complete-integrations.sh\",\n    \"mcp-integrate\": \"node scripts/integrate-mcp-servers.js\",\n    \"mcp-test-filesystem\": \"node node_modules/FileScopeMCP/dist/index.js --help\",\n    \"mcp-test-browserbase\": \"node scripts/browserbase-test.js\",\n    \"mcp-generate-diagrams\": \"node scripts/integrate-mcp-servers.js --diagrams-only\",\n    \"mcp-analyze-repo\": \"node scripts/integrate-mcp-servers.js --analyze-only\",\n    \"mcp-server-start\": \"cd mcp-server && npm run orchestrator\",\n    \"mcp-test-integration\": \"node scripts/test-mcp-integration.js\",\n    \"test:deployment\": \"./tests/deployment-core.test.sh\",\n    \"validate:deployment\": \"./tests/deployment-core.test.sh && ./tests/mcp-integration.test.sh\",\n    \"validate:scripts\": \"bash -n scripts/*.sh && bash -n *.sh\",\n    \"validate:env\": \"node -e \\\"require('dotenv').config(); console.log('Environment validation passed')\\\"\",\n    \"analyze:json-data\": \"node scripts/analyze-json-data.js\",\n    \"merge:json-data\": \"node scripts/merge-json-data.js\",\n    \"validate:merged-data\": \"node scripts/validate-merged-data.js\",\n    \"data:complete-analysis\": \"npm run analyze:json-data && npm run merge:json-data && npm run validate:merged-data\",\n    \"validate:comprehensive\": \"node scripts/comprehensive-validation.js\",\n    \"validate:api-keys\": \"node scripts/validate-api-keys.js --all\",\n    \"validate:api-comprehensive\": \"node scripts/comprehensive-api-testing.js\",\n    \"validate:spotify\": \"node scripts/validate-api-keys.js --spotify\",\n    \"validate:openai\": \"node scripts/validate-api-keys.js --openai\",\n    \"validate:gemini\": \"node scripts/validate-api-keys.js --gemini\",\n    \"validate:mongodb\": \"node scripts/validate-api-keys.js --mongodb\",\n    \"validate:mongodb-comprehensive\": \"node scripts/validate-mongodb-connection.js\",\n    \"validate:mongodb-enhanced\": \"node scripts/validate-enhanced-mongodb.js\",\n    \"populate:spotify-analytics\": \"node scripts/populate-spotify-analytics.js\",\n    \"process:enhanced-data\": \"node scripts/process-enhanced-data.js\",\n    \"analyze:listening-history\": \"node scripts/analyze-listening-history-merge.js\",\n    \"enhance:audio-features\": \"node scripts/enhance-audio-features.js\",\n    \"diagnostic:data\": \"node scripts/data-diagnostic.js\",\n    \"optimize:database-ai\": \"node scripts/optimize-database-ai.js\",\n    \"fetch:missing-audio-features\": \"node scripts/fetch-missing-audio-features.js\",\n    \"implement:feature-vectors\": \"node scripts/implement-feature-vectors.js\",\n    \"status:redis-roadmap\": \"node scripts/redis-roadmap-status.js\",\n    \"validate:mcp-server\": \"node scripts/validate-api-keys.js --mcp-server\",\n    \"validate:security\": \"node scripts/validate-api-keys.js --security\",\n    \"validate:ssl\": \"node scripts/validate-api-keys.js --ssl\",\n    \"validate:docker\": \"node scripts/validate-api-keys.js --docker\",\n    \"test:servers\": \"node scripts/test-all-servers.js\",\n    \"test:docker-hub\": \"node scripts/test-all-servers.js && echo 'Testing Docker Hub specifically...'\",\n    \"test:digitalocean\": \"node scripts/test-all-servers.js && echo 'Testing DigitalOcean services...'\",\n    \"test:registries\": \"node scripts/test-all-servers.js && echo 'Testing all container registries...'\",\n    \"auth:wizard\": \"node scripts/auth-wizard.js\",\n    \"auth:setup\": \"node scripts/auth-wizard.js\",\n    \"deployment:status\": \"node scripts/deployment-status.js\",\n    \"deployment:report\": \"node scripts/deployment-status.js && cat DEPLOYMENT_STATUS_REPORT.md\",\n    \"do:status\": \"node scripts/digitalocean-manager.js status\",\n    \"do:apps\": \"node scripts/digitalocean-manager.js apps\",\n    \"do:droplets\": \"node scripts/digitalocean-manager.js droplets\",\n    \"do:registries\": \"node scripts/digitalocean-manager.js registries\",\n    \"do:k8s\": \"node scripts/digitalocean-manager.js k8s\",\n    \"do:docker-login\": \"node scripts/digitalocean-manager.js docker-login\",\n    \"do:deploy\": \"node scripts/digitalocean-manager.js deploy\",\n    \"do:report\": \"node scripts/digitalocean-manager.js report\",\n    \"do:auth\": \"node scripts/digitalocean-manager.js auth\",\n    \"do:enhanced\": \"node scripts/enhanced-digitalocean-manager.js\",\n    \"do:enhanced-test\": \"node scripts/enhanced-digitalocean-manager.js test\",\n    \"do:enhanced-auth\": \"node scripts/enhanced-digitalocean-manager.js auth\",\n    \"do:enhanced-registry-token\": \"node scripts/enhanced-digitalocean-manager.js registry-token\",\n    \"do:enhanced-account\": \"node scripts/enhanced-digitalocean-manager.js account\",\n    \"do:enhanced-update-env\": \"node scripts/enhanced-digitalocean-manager.js update-env\",\n    \"config:report\": \"node scripts/update-env-config.js\",\n    \"config:add-missing\": \"node scripts/update-env-config.js --add-missing --backup\",\n    \"config:interactive\": \"node scripts/update-env-config.js --interactive\",\n    \"config:dry-run\": \"node scripts/update-env-config.js --add-missing --dry-run\",\n    \"automate:mcp\": \"node scripts/mcp-automation.js\",\n    \"automate:validate\": \"node scripts/mcp-automation.js validate\",\n    \"automate:test\": \"node scripts/mcp-automation.js test\",\n    \"automate:docs\": \"node scripts/mcp-automation.js docs\",\n    \"automate:health\": \"node scripts/mcp-automation.js health\",\n    \"automate:optimize\": \"node scripts/mcp-automation.js optimize\",\n    \"automate:all\": \"node scripts/mcp-automation.js all\",\n    \"automate:status\": \"node scripts/mcp-automation.js status\",\n    \"automate:report\": \"node scripts/mcp-automation.js report\",\n    \"validate:comprehensive-mcp\": \"node scripts/comprehensive-mcp-validation.js\",\n    \"automate:enhanced\": \"node scripts/enhanced-mcp-automation.js\",\n    \"validate:full-system\": \"node scripts/enhanced-mcp-automation.js\",\n    \"mcp-health-check\": \"curl -s http://localhost:3001/health | jq '.' || echo 'MCP server not running'\",\n    \"mcp:registry-orchestrator\": \"node mcp-server/enhanced-registry-orchestrator.js\",\n    \"mcp:orchestrator-stop\": \"node mcp-server/enhanced-registry-orchestrator.js stop\",\n    \"mcp:comprehensive-suite\": \"npm run mcp:enhanced-validation && npm run mcp:health-monitor &\",\n    \"mcp-manage\": \"node scripts/mcp-manager.js\",\n    \"mcp-test-all\": \"node scripts/mcp-manager.js test\",\n    \"mcp-validate\": \"node scripts/validate-mcp-integration.js\",\n    \"merge-csv\": \"python scripts/merge_csv_data.py\",\n    \"setup-db\": \"python scripts/database_setup.py\",\n    \"populate-audio\": \"python scripts/populate_audio_features.py\",\n    \"migrate-mongodb\": \"python scripts/migrate_to_mongodb.py\",\n    \"migrate-supabase\": \"python scripts/migrate_to_supabase.py\",\n    \"mcp-spotify\": \"cd mcp-server && python spotify_server.py\",\n    \"analyze-data\": \"python scripts/analyze_listening_data.py\",\n    \"train-model\": \"python scripts/train_recommendation_model.py\",\n    \"prompts\": \"node prompts/tools/cli.js\",\n    \"prompts:validate\": \"node prompts/tools/validator.js validate\",\n    \"prompts:execute\": \"node prompts/tools/executor.js execute\",\n    \"prompts:test\": \"node prompts/tools/executor.js test\",\n    \"prompts:list\": \"node prompts/tools/executor.js list\",\n    \"prompts:fix\": \"node prompts/tools/validator.js fix\",\n    \"prompts:server\": \"node prompts/tools/cli.js server\",\n    \"perplexity:exec\": \"node prompts/tools/executor.js execute analysis/user-driven-sonar-pro --user_prompt\",\n    \"gemini-test\": \"node scripts/test-gemini-integration.js\",\n    \"gemini-health\": \"node scripts/test-gemini-integration.js\",\n    \"test:gemini-integration\": \"node scripts/test-gemini-integration.js\",\n    \"test:automation-integration\": \"node scripts/test-automation-integration.js\",\n    \"test:perplexity-grok4\": \"npm run test:integration -- --testPathPattern=perplexity-grok4-integration-tests.js\",\n    \"demo:automation\": \"node scripts/demo-automation-workflow.js\",\n    \"status:automation\": \"node scripts/automation-system-status.js\",\n    \"research:music\": \"node scripts/music-research-automation.js\",\n    \"test:music-integration\": \"npm run test:integration -- --testPathPattern=music.*test\",\n    \"production-check\": \"node scripts/production-readiness-orchestrator.js --production-check\",\n    \"production-deploy\": \"./scripts/deploy-digitalocean.sh\",\n    \"workflow:analyze\": \"node scripts/workflow-optimizer.js analyze\",\n    \"workflow:optimize\": \"node scripts/workflow-optimizer.js optimize\",\n    \"workflow:optimize:apply\": \"node scripts/workflow-optimizer.js optimize --apply\",\n    \"workflow:status\": \"node agent-workflow/workflow-cli.js status\",\n    \"workflow:report\": \"node scripts/workflow-optimizer.js report\",\n    \"agent:run\": \"node scripts/continuous-agent.js\",\n    \"agent:analyze\": \"node scripts/continuous-agent.js analyze\",\n    \"agent:create-issue\": \"node scripts/continuous-agent.js create-issue\",\n    \"agent:status\": \"node scripts/continuous-agent.js status\",\n    \"agent:config\": \"cat agent-workflow/config/config.json\",\n    \"agent:enable\": \"node -e \\\"const fs=require('fs'); const config=require('./agent-workflow/config/config.json'); config.enabled=true; fs.writeFileSync('./agent-workflow/config/config.json', JSON.stringify(config,null,2));\\\"\",\n    \"agent:disable\": \"node -e \\\"const fs=require('fs'); const config=require('./agent-workflow/config/config.json'); config.enabled=false; fs.writeFileSync('./agent-workflow/config/config.json', JSON.stringify(config,null,2));\\\"\",\n    \"workflow:templates\": \"node agent-workflow/workflow-cli.js templates\",\n    \"workflow:create\": \"node agent-workflow/workflow-cli.js create\",\n    \"workflow:active\": \"node agent-workflow/workflow-cli.js active\",\n    \"workflow:validate\": \"node agent-workflow/workflow-cli.js validate\",\n    \"workflow:generate\": \"node agent-workflow/workflow-cli.js generate\",\n    \"workflow:cli\": \"node agent-workflow/workflow-cli.js\",\n    \"validate:digitalocean\": \"./scripts/validate-digitalocean-deployment.sh\",\n    \"validate:deployment-config\": \"./scripts/validate-digitalocean-deployment.sh\",\n    \"docker:setup\": \"./scripts/docker/docker-ubuntu-setup.sh\",\n    \"docker:deploy\": \"./scripts/simple-deploy.sh\",\n    \"docker:manage\": \"./scripts/docker/docker-manager.sh\",\n    \"docker:optimize\": \"./scripts/docker/docker-manager.sh optimize\",\n    \"docker:monitor\": \"./scripts/docker/docker-manager.sh monitor\",\n    \"docker:check\": \"./scripts/docker/docker-manager.sh check\",\n    \"docker:report\": \"./scripts/docker/docker-manager.sh report\",\n    \"deploy:docker\": \"./scripts/simple-deploy.sh deploy\",\n    \"deploy:ubuntu\": \"./scripts/docker/docker-ubuntu-setup.sh && ./scripts/simple-deploy.sh\",\n    \"setup:redis\": \"node scripts/setup-redis.js\",\n    \"configure:redis\": \"node scripts/configure-redis.js\",\n    \"validate:redis\": \"node -e \\\"const redis = require('./src/utils/redis-manager'); redis.ping().then(() => {console.log('✅ Redis connected'); return redis.close();}).catch(e => {console.error('❌ Redis failed:', e.message); process.exit(1);}).finally(() => process.exit(0))\\\"\",\n    \"redis:health\": \"node -e \\\"const RedisManager = require('./scripts/configure-redis'); const r = new RedisManager(); r.initialize().then(() => r.healthCheck()).then(h => console.log(JSON.stringify(h, null, 2))).finally(() => r.close())\\\"\",\n    \"redis:stats\": \"node -e \\\"const RedisManager = require('./scripts/configure-redis'); const r = new RedisManager(); r.initialize().then(() => r.getCacheStats()).then(s => console.log(JSON.stringify(s, null, 2))).finally(() => r.close())\\\"\",\n    \"redis:clear\": \"node -e \\\"const RedisManager = require('./scripts/configure-redis'); const r = new RedisManager(); r.initialize().then(() => r.clearCache()).then(() => console.log('✅ Cache cleared')).finally(() => r.close())\\\"\",\n    \"redis:clear-audio\": \"node -e \\\"const RedisManager = require('./scripts/configure-redis'); const r = new RedisManager(); r.initialize().then(() => r.clearCache('audio_features:*')).then(count => console.log('✅ Cleared', count, 'audio features')).finally(() => r.close())\\\"\",\n    \"redis:clear-recommendations\": \"node -e \\\"const RedisManager = require('./scripts/configure-redis'); const r = new RedisManager(); r.initialize().then(() => r.clearCache('recommendations:*')).then(count => console.log('✅ Cleared', count, 'recommendations')).finally(() => r.close())\\\"\",\n    \"performance:baseline\": \"node src/utils/performance-baseline.js\",\n    \"performance:smoke-test\": \"node scripts/performance-smoke-test.js\",\n    \"performance:mcp-analytics\": \"node -e \\\"const {MCPPerformanceAnalytics} = require('./src/utils/mcp-performance-analytics'); const analytics = new MCPPerformanceAnalytics(); analytics.runAnalytics().catch(console.error);\\\"\",\n    \"test:performance-smoke\": \"npm run performance:smoke-test -- --duration 30\",\n    \"security:audit\": \"./scripts/security-audit.sh\",\n    \"security:check\": \"npm audit && ./scripts/security-audit.sh\",\n    \"production:validate\": \"./scripts/security-audit.sh && npm audit --audit-level=high\",\n    \"production:ready\": \"npm run lint && npm run test && npm run security:audit && npm run build\",\n    \"mcp:n8n_mcp\": \"node mcp-servers/new-candidates/n8n-mcp/integration.js\",\n    \"test:n8n_mcp\": \"jest mcp-servers/new-candidates/n8n-mcp/test.js\",\n    \"mcp:mcp_server_code_runner\": \"node mcp-servers/new-candidates/mcp-server-code-runner/integration.js\",\n    \"test:mcp_server_code_runner\": \"jest mcp-servers/new-candidates/mcp-server-code-runner/test.js\",\n    \"mcp:mongodb_mcp_server\": \"node mcp-servers/new-candidates/mongodb-mcp-server/integration.js\",\n    \"test:mongodb_mcp_server\": \"jest mcp-servers/new-candidates/mongodb-mcp-server/test.js\",\n    \"mcp:puppeteer_mcp_server\": \"node mcp-servers/new-candidates/puppeteer-mcp-server/integration.js\",\n    \"test:puppeteer_mcp_server\": \"jest mcp-servers/new-candidates/puppeteer-mcp-server/test.js\",\n    \"mcp:hismaserver_puppeteer\": \"node mcp-servers/new-candidates/@hisma/server-puppeteer/integration.js\",\n    \"test:hismaserver_puppeteer\": \"jest mcp-servers/new-candidates/@hisma/server-puppeteer/test.js\",\n    \"mcp:candidates\": \"node scripts/run-all-candidates.js\",\n    \"test:candidates\": \"jest mcp-servers/new-candidates/*/test.js\",\n    \"enhanced-mcp:start\": \"node src/mcp/enhanced-multimodel-orchestrator.js\",\n    \"enhanced-mcp:workflow\": \"node src/mcp/workflow-integration-manager.js\",\n    \"enhanced-mcp:test\": \"node -e \\\"const WorkflowManager = require('./src/mcp/workflow-integration-manager'); const manager = new WorkflowManager(); console.log('Enhanced MCP system initialized successfully');\\\"\",\n    \"enhanced-mcp:health\": \"curl -s http://localhost:3000/api/enhanced-mcp/health | jq '.' || echo 'Enhanced MCP server not running'\",\n    \"enhanced-mcp:capabilities\": \"curl -s http://localhost:3000/api/enhanced-mcp/capabilities | jq '.' || echo 'Enhanced MCP server not running'\",\n    \"enhanced-mcp:models\": \"curl -s http://localhost:3000/api/enhanced-mcp/models | jq '.' || echo 'Enhanced MCP server not running'\",\n    \"production-readiness\": \"node scripts/production-readiness-analyzer.js\",\n    \"production-automation\": \"node scripts/mcp-production-automation.js\",\n    \"production-analysis\": \"node scripts/production-readiness-orchestrator.js\",\n    \"production-analysis:quick\": \"node scripts/production-readiness-orchestrator.js --quick\",\n    \"production-analysis:full\": \"node scripts/production-readiness-orchestrator.js --full\",\n    \"production-fixes\": \"npm run lint:fix && npm audit fix && npm run format\",\n    \"production-ready\": \"npm run production-analysis && echo 'Check PRODUCTION_READINESS_EXECUTIVE_SUMMARY.md for results'\",\n    \"mcp:health:n8n\": \"node scripts/mcp/probes/probe-n8n.js\",\n    \"mcp:health:mongodb\": \"node scripts/mcp/probes/probe-mongodb.js\",\n    \"mcp:validate-all\": \"node validate-all-mcp-servers.js\"\n  },\n  \"keywords\": [\n    \"music-discovery\",\n    \"music-recommendations\",\n    \"spotify-integration\",\n    \"ai-music-chat\",\n    \"music-analytics\",\n    \"conversational-ai\",\n    \"music-platform\",\n    \"playlist-generation\"\n  ],\n  \"author\": \"EchoTune AI Team\",\n  \"license\": \"MIT\",\n  \"repository\": {\n    \"type\": \"git\",\n    \"url\": \"https://github.com/dzp5103/Spotify-echo.git\"\n  },\n  \"bugs\": {\n    \"url\": \"https://github.com/dzp5103/Spotify-echo/issues\"\n  },\n  \"homepage\": \"https://github.com/dzp5103/Spotify-echo#readme\",\n  \"engines\": {\n    \"node\": \">=20.0.0\",\n    \"npm\": \">=10.0.0\",\n    \"python\": \">=3.8\"\n  },\n  \"dependencies\": {\n    \"@babel/preset-react\": \"^7.27.1\",\n    \"@browserbasehq/mcp-server-browserbase\": \"github:browserbase/mcp-server-browserbase\",\n    \"@emotion/react\": \"^11.14.0\",\n    \"@emotion/styled\": \"^11.14.1\",\n    \"@google/generative-ai\": \"^0.2.1\",\n    \"@hisma/server-puppeteer\": \"^0.6.5\",\n    \"@modelcontextprotocol/sdk\": \"^1.17.3\",\n    \"@modelcontextprotocol/server-filesystem\": \"^2025.7.29\",\n    \"@modelcontextprotocol/server-memory\": \"^2025.8.4\",\n    \"@modelcontextprotocol/server-puppeteer\": \"^2025.5.12\",\n    \"@modelcontextprotocol/server-sequential-thinking\": \"^2025.7.1\",\n    \"@mui/icons-material\": \"^7.3.1\",\n    \"@mui/material\": \"^7.3.1\",\n    \"@mui/system\": \"^7.3.1\",\n    \"@octokit/rest\": \"^22.0.0\",\n    \"@sentry/node\": \"^10.3.0\",\n    \"@supabase/supabase-js\": \"^2.53.0\",\n    \"ajv\": \"^8.12.0\",\n    \"ajv-formats\": \"^2.1.1\",\n    \"better-sqlite3\": \"^12.2.0\",\n    \"commander\": \"^12.0.0\",\n    \"compression\": \"^1.7.4\",\n    \"cookie-parser\": \"^1.4.7\",\n    \"cors\": \"^2.8.5\",\n    \"csv-parser\": \"^3.2.0\",\n    \"express\": \"^4.18.0\",\n    \"express-rate-limit\": \"^7.1.5\",\n    \"express-session\": \"^1.18.2\",\n    \"express-slow-down\": \"^2.0.1\",\n    \"FileScopeMCP\": \"github:admica/FileScopeMCP\",\n    \"glob\": \"^11.0.3\",\n    \"helmet\": \"^7.1.0\",\n    \"js-yaml\": \"^4.1.0\",\n    \"jsonwebtoken\": \"^9.0.2\",\n    \"lodash\": \"^4.17.21\",\n    \"mcp-server-code-runner\": \"^0.1.7\",\n    \"mongodb-mcp-server\": \"^0.2.0\",\n    \"multer\": \"^2.0.0\",\n    \"n8n-mcp\": \"^2.10.2\",\n    \"node-cache\": \"^5.1.2\",\n    \"node-fetch\": \"^3.3.2\",\n    \"openai\": \"^4.24.0\",\n    \"prop-types\": \"^15.8.1\",\n    \"puppeteer-mcp-server\": \"^0.7.2\",\n    \"react\": \"^19.1.1\",\n    \"react-dom\": \"^19.1.1\",\n    \"react-router-dom\": \"^7.7.1\",\n    \"redis\": \"^4.7.1\",\n    \"socket.io\": \"^4.7.0\",\n    \"socket.io-client\": \"^4.8.1\",\n    \"sqlite3\": \"^5.1.7\",\n    \"uuid\": \"^9.0.1\",\n    \"ws\": \"^8.14.0\"\n  },\n  \"devDependencies\": {\n    \"@azure/openai\": \"^2.0.0\",\n    \"@babel/core\": \"^7.28.0\",\n    \"@babel/plugin-transform-modules-commonjs\": \"^7.27.1\",\n    \"@babel/preset-env\": \"^7.28.0\",\n    \"@eslint/js\": \"^9.33.0\",\n    \"@types/cors\": \"^2.8.0\",\n    \"@types/express\": \"^4.17.0\",\n    \"@types/jest\": \"^29.0.0\",\n    \"@types/multer\": \"^1.4.0\",\n    \"@types/node\": \"^20.0.0\",\n    \"@typescript-eslint/eslint-plugin\": \"^6.0.0\",\n    \"@typescript-eslint/parser\": \"^6.0.0\",\n    \"@vitejs/plugin-react\": \"^4.7.0\",\n    \"autoprefixer\": \"^10.4.21\",\n    \"axios\": \"^1.11.0\",\n    \"babel-jest\": \"^30.0.5\",\n    \"concurrently\": \"^9.2.0\",\n    \"dotenv\": \"^16.6.1\",\n    \"eslint\": \"^8.0.0\",\n    \"eslint-config-prettier\": \"^9.0.0\",\n    \"eslint-plugin-prettier\": \"^5.0.0\",\n    \"eslint-plugin-react\": \"^7.37.5\",\n    \"eslint-plugin-react-hooks\": \"^5.2.0\",\n    \"globals\": \"^16.3.0\",\n    \"jest\": \"^29.7.0\",\n    \"jest-environment-jsdom\": \"^30.0.5\",\n    \"mongodb\": \"^6.18.0\",\n    \"nodemon\": \"^3.0.0\",\n    \"postcss\": \"^8.5.6\",\n    \"prettier\": \"^3.0.0\",\n    \"puppeteer\": \"^24.16.2\",\n    \"supertest\": \"^7.1.4\",\n    \"swagger-jsdoc\": \"^6.2.8\",\n    \"swagger-ui-express\": \"^5.0.1\",\n    \"terser\": \"^5.43.1\",\n    \"ts-jest\": \"^29.0.0\",\n    \"typescript\": \"^5.0.0\",\n    \"vite\": \"^7.0.6\",\n    \"vite-plugin-compression\": \"^0.5.1\",\n    \"web-vitals\": \"^3.5.2\",\n    \"webpack\": \"^5.0.0\",\n    \"webpack-cli\": \"^5.0.0\"\n  },\n  \"mcp\": {\n    \"servers\": {\n      \"browser\": {\n        \"command\": \"npx\",\n        \"args\": [\n          \"@modelcontextprotocol/server-puppeteer\"\n        ],\n        \"env\": {\n          \"PUPPETEER_HEADLESS\": \"true\"\n        }\n      },\n      \"browserbase\": {\n        \"command\": \"npx\",\n        \"args\": [\n          \"@browserbasehq/mcp-server-browserbase\"\n        ],\n        \"env\": {\n          \"BROWSERBASE_API_KEY\": \"${BROWSERBASE_API_KEY}\",\n          \"BROWSERBASE_PROJECT_ID\": \"${BROWSERBASE_PROJECT_ID}\"\n        }\n      },\n      \"filesystem\": {\n        \"command\": \"node\",\n        \"args\": [\n          \"node_modules/FileScopeMCP/dist/mcp-server.js\"\n        ],\n        \"env\": {\n          \"ALLOWED_DIRECTORIES\": \"${PWD},${PWD}/src,${PWD}/scripts,${PWD}/mcp-server\"\n        }\n      },\n      \"spotify\": {\n        \"command\": \"python\",\n        \"args\": [\n          \"mcp-server/spotify_server.py\"\n        ],\n        \"env\": {\n          \"SPOTIFY_CLIENT_ID\": \"${SPOTIFY_CLIENT_ID}\",\n          \"SPOTIFY_CLIENT_SECRET\": \"${SPOTIFY_CLIENT_SECRET}\"\n        }\n      },\n      \"sequential-thinking\": {\n        \"command\": \"node\",\n        \"args\": [\n          \"mcp-servers/sequential-thinking/dist/index.js\"\n        ],\n        \"description\": \"Structured thinking and reasoning capabilities for complex tasks\"\n      },\n      \"screenshot-website\": {\n        \"command\": \"node\",\n        \"args\": [\n          \"mcp-servers/screenshot-website/dist/index.js\"\n        ],\n        \"description\": \"Fast website screenshot capabilities for automation\"\n      },\n      \"enhanced-file-utilities\": {\n        \"command\": \"node\",\n        \"args\": [\n          \"mcp-servers/enhanced-file-utilities.js\"\n        ],\n        \"description\": \"Enhanced file handling with validation and security\"\n      },\n      \"enhanced-browser-tools\": {\n        \"command\": \"node\",\n        \"args\": [\n          \"mcp-servers/enhanced-browser-tools.js\"\n        ],\n        \"description\": \"Improved browser automation with error checking\"\n      },\n      \"comprehensive-validator\": {\n        \"command\": \"node\",\n        \"args\": [\n          \"mcp-servers/comprehensive-validator.js\"\n        ],\n        \"description\": \"System-wide validation and monitoring\"\n      }\n    }\n  },\n  \"jest\": {\n    \"testEnvironment\": \"jsdom\",\n    \"setupFilesAfterEnv\": [\n      \"<rootDir>/tests/setup.js\"\n    ],\n    \"testMatch\": [\n      \"**/__tests__/**/*.test.{js,ts}\",\n      \"**/tests/**/*.test.{js,ts}\"\n    ],\n    \"collectCoverageFrom\": [\n      \"src/**/*.{js,ts}\",\n      \"!src/**/*.d.ts\"\n    ],\n    \"coverageDirectory\": \"coverage\",\n    \"coverageReporters\": [\n      \"text\",\n      \"lcov\",\n      \"html\"\n    ],\n    \"moduleNameMapper\": {\n      \"^@/(.*)$\": \"<rootDir>/src/$1\"\n    },\n    \"transform\": {\n      \"^.+\\\\.js$\": \"babel-jest\"\n    },\n    \"transformIgnorePatterns\": [\n      \"node_modules/(?!(mongodb|bson)/)\"\n    ]\n  },\n  \"eslintConfig\": {\n    \"extends\": [\n      \"eslint:recommended\",\n      \"plugin:react/recommended\",\n      \"plugin:react-hooks/recommended\"\n    ],\n    \"plugins\": [\n      \"react\",\n      \"react-hooks\"\n    ],\n    \"env\": {\n      \"node\": true,\n      \"browser\": true,\n      \"es2021\": true,\n      \"jest\": true\n    },\n    \"parserOptions\": {\n      \"ecmaVersion\": 2021,\n      \"sourceType\": \"module\",\n      \"ecmaFeatures\": {\n        \"jsx\": true\n      }\n    },\n    \"settings\": {\n      \"react\": {\n        \"version\": \"detect\"\n      }\n    },\n    \"rules\": {\n      \"no-unused-vars\": [\n        \"error\",\n        {\n          \"argsIgnorePattern\": \"^_\",\n          \"varsIgnorePattern\": \"^_\"\n        }\n      ],\n      \"no-console\": \"off\",\n      \"semi\": [\n        \"error\",\n        \"always\"\n      ],\n      \"quotes\": [\n        \"error\",\n        \"single\"\n      ],\n      \"react/react-in-jsx-scope\": \"off\",\n      \"react/jsx-uses-react\": \"off\",\n      \"react/prop-types\": \"off\"\n    },\n    \"overrides\": [\n      {\n        \"files\": [\n          \"src/mobile/mobile-responsive.js\",\n          \"src/security/security-manager.js\",\n          \"src/utils/performance-manager.js\"\n        ],\n        \"env\": {\n          \"browser\": true,\n          \"node\": true\n        }\n      },\n      {\n        \"files\": [\n          \"**/*.jsx\",\n          \"**/*.tsx\"\n        ],\n        \"rules\": {\n          \"react/react-in-jsx-scope\": \"off\"\n        }\n      }\n    ]\n  },\n  \"prettier\": {\n    \"semi\": true,\n    \"trailingComma\": \"es5\",\n    \"singleQuote\": true,\n    \"printWidth\": 100,\n    \"tabWidth\": 2\n  }\n}\n\nDirectory structure: [\n  \"./validation-reports/comprehensive-validation-1755347567054.md\",\n  \"./validation-reports/comprehensive-validation-1755354166280.md\",\n  \"./validation-reports/comprehensive-validation-2025-08-16T10-19-31-002Z.json\",\n  \"./validation-reports/linting-fixes-1755354875811.json\",\n  \"./validation-reports/validation-summary-2025-08-16T10-19-31-002Z.md\",\n  \"./validation-reports/validation-summary-2025-08-16T10-07-04-901Z.md\",\n  \"./validation-reports/comprehensive-validation-1755347567053.json\",\n  \"./validation-reports/comprehensive-validation-1755354166275.json\",\n  \"./validation-reports/comprehensive-validation-2025-08-16T10-07-04-901Z.json\",\n  \"./enhanced-perplexity-results/enhanced-perplexity-test-grok4-2025-08-16T10-16-40-664Z.json\",\n  \"./enhanced-perplexity-results/enhanced-perplexity-comprehensive-2025-08-16T12-29-27-453Z.json\",\n  \"./enhanced-perplexity-results/enhanced-perplexity-multi-research-2025-08-16T14-25-17-970Z.json\",\n  \"./enhanced-perplexity-results/enhanced-perplexity-analyze-repo-2025-08-16T14-24-01-220Z.json\",\n  \"./enhanced-perplexity-grok4-integration.js\",\n  \"./Connect to cursor.pdf\",\n  \"./DEPLOYMENT.md\",\n  \"./integrate-mcp-workflows.js\",\n  \"./search-results/repo-analysis-1755335045128.json\",\n  \"./search-results/search-1755334998412.json\",\n  \"./search-results/multi-search-1755335090978.json\",\n  \"./requirements-production.txt\",\n  \"./env.example (6).txt\",\n  \"./ROADMAP_AUTO.md\",\n  \"./INTEGRATION_COMPLETE_REPORT.md\",\n  \"./MCP_SERVERS_INTEGRATION_GUIDE.md\",\n  \"./api-testing-results.json\",\n  \"./scripts/test-all-servers.js\",\n  \"./scripts/fix-redis-url.js\",\n  \"./scripts/implement-new-mcp-candidates.js\",\n  \"./scripts/status-heartbeat.js\",\n  \"./scripts/analyze-automation-scripts.js\",\n  \"./scripts/integrate-mcp.sh\",\n  \"./scripts/ci/run-tests.sh\",\n  \"./scripts/ci/setup.sh\",\n  \"./scripts/demo-automation-workflow.js\",\n  \"./scripts/enhance-audio-features.js\",\n  \"./scripts/test-mcp-automation.js\",\n  \"./scripts/analyze-missing-data.js\",\n  \"./scripts/test-comprehensive-mcp-integration.js\",\n  \"./scripts/mcp/logs.sh\",\n  \"./scripts/mcp/probes/probe-n8n.js\",\n  \"./scripts/mcp/probes/probe-mongodb.js\",\n  \"./scripts/mcp/healthcheck.sh\",\n  \"./scripts/mcp/comprehensive-test-suite.js\",\n  \"./scripts/mcp/automation-progress-test.js\",\n  \"./scripts/mcp/run.sh\",\n  \"./scripts/mcp/down.sh\",\n  \"./scripts/mcp/live-server-test.js\",\n  \"./scripts/mcp/up.sh\",\n  \"./scripts/mcp/guards/require-prod-approval.sh\"\n]\n\nPlease provide:\n1. Project architecture assessment\n2. Technology stack evaluation\n3. Scalability considerations\n4. Security assessment\n5. Performance optimization opportunities\n- Relevant insights and recommendations\n- Technical implementation details\n- Performance considerations",
        "citations": [
          {
            "url": "https://example.com/source1",
            "snippet": "Mock citation 1"
          },
          {
            "url": "https://example.com/source2",
            "snippet": "Mock citation 2"
          }
        ],
        "model": "grok-4",
        "usage": {
          "tokens": 150
        }
      },
      "timestamp": "2025-08-16T16:48:07.161Z"
    },
    "technologyStack": {
      "coreStack": {
        "content": "Mock response for: Research the latest best practices and updates for this technology stack used in EchoTune AI:\n\nCore Technologies:\n- Node.js 20 + Express.js + Socket.io\n- React 19 + Material-UI + Vite\n- MongoDB + Redis + SQLite fallback\n- Docker + nginx + SSL automation\n- OpenAI GPT-4o + Google Gemini 2.0 + Claude 3.5\n\nAI/ML Components:\n- Multi-provider LLM integration\n- Perplexity API for research\n- MCP (Model Context Protocol) servers\n- Music recommendation algorithms\n- Real-time chat systems\n\nPlease provide:\n1. Latest versions and security updates\n2. Performance optimization opportunities\n3. Best practices for each technology\n4. Integration improvements\n5. Scalability recommendations\n6. Security considerations\n\nThis is a simulated Perplexity API response. To get real results, configure PERPLEXITY_API_KEY environment variable.\n\nKey findings:\n- Analysis of Research the latest best practices and updates for this technology stack used in EchoTune AI:\n\nCore Technologies:\n- Node.js 20 + Express.js + Socket.io\n- React 19 + Material-UI + Vite\n- MongoDB + Redis + SQLite fallback\n- Docker + nginx + SSL automation\n- OpenAI GPT-4o + Google Gemini 2.0 + Claude 3.5\n\nAI/ML Components:\n- Multi-provider LLM integration\n- Perplexity API for research\n- MCP (Model Context Protocol) servers\n- Music recommendation algorithms\n- Real-time chat systems\n\nPlease provide:\n1. Latest versions and security updates\n2. Performance optimization opportunities\n3. Best practices for each technology\n4. Integration improvements\n5. Scalability recommendations\n6. Security considerations\n- Relevant insights and recommendations\n- Technical implementation details\n- Performance considerations",
        "citations": [
          {
            "url": "https://example.com/source1",
            "snippet": "Mock citation 1"
          },
          {
            "url": "https://example.com/source2",
            "snippet": "Mock citation 2"
          }
        ],
        "model": "sonar-pro",
        "usage": {
          "tokens": 150
        }
      },
      "mcpProtocol": {
        "content": "Mock response for: Research Model Context Protocol (MCP) latest developments, best practices, and integration patterns for AI applications in 2025\n\nThis is a simulated Perplexity API response. To get real results, configure PERPLEXITY_API_KEY environment variable.\n\nKey findings:\n- Analysis of Research Model Context Protocol (MCP) latest developments, best practices, and integration patterns for AI applications in 2025\n- Relevant insights and recommendations\n- Technical implementation details\n- Performance considerations",
        "citations": [
          {
            "url": "https://example.com/source1",
            "snippet": "Mock citation 1"
          },
          {
            "url": "https://example.com/source2",
            "snippet": "Mock citation 2"
          }
        ],
        "model": "sonar-pro",
        "usage": {
          "tokens": 150
        }
      },
      "timestamp": "2025-08-16T16:48:07.161Z"
    },
    "integrationMap": {
      "mcpConfig": {
        "$schema": "https://modelcontextprotocol.io/schema/cursor-mcp.json",
        "mcpServers": {
          "echotune-perplexity": {
            "command": "node",
            "args": [
              "./mcp-servers/perplexity-mcp/perplexity-mcp-server.js"
            ],
            "env": {
              "PERPLEXITY_API_KEY": "${PERPLEXITY_API_KEY}",
              "PERPLEXITY_MODEL": "llama-3.1-sonar-small-128k-online",
              "PERPLEXITY_MAX_LATENCY_MS": "1500",
              "PERPLEXITY_MAX_MEMORY_MB": "256",
              "PERPLEXITY_COST_BUDGET_USD": "0.50",
              "DEBUG": "true"
            }
          },
          "echotune-filesystem": {
            "command": "npx",
            "args": [
              "@modelcontextprotocol/server-filesystem",
              "./src",
              "./scripts",
              "./mcp-server"
            ],
            "env": {}
          },
          "package-manager": {
            "command": "node",
            "args": [
              "./mcp-servers/package-management/package-version-mcp.js"
            ],
            "env": {}
          },
          "analytics": {
            "command": "node",
            "args": [
              "./mcp-servers/analytics-server/analytics-mcp.js"
            ],
            "env": {}
          },
          "testing": {
            "command": "node",
            "args": [
              "./mcp-servers/testing-automation/testing-automation-mcp.js"
            ],
            "env": {}
          },
          "brave-search": {
            "command": "npx",
            "args": [
              "@modelcontextprotocol/server-brave-search"
            ],
            "env": {
              "BRAVE_API_KEY": "${BRAVE_API_KEY}"
            }
          },
          "browserbase": {
            "command": "node",
            "args": [
              "./mcp-servers/browserbase/browserbase-mcp.js"
            ],
            "env": {
              "BROWSERBASE_API_KEY": "${BROWSERBASE_API_KEY}",
              "BROWSERBASE_PROJECT_ID": "${BROWSERBASE_PROJECT_ID}",
              "BROWSERBASE_SESSION_ID": "${BROWSERBASE_SESSION_ID}"
            }
          },
          "memory": {
            "command": "npx",
            "args": [
              "@modelcontextprotocol/server-memory"
            ],
            "env": {
              "MEMORY_DB_PATH": ".cursor/memory.sqlite",
              "MEMORY_MAX_MB": "64"
            }
          },
          "perplexity-ask": {
            "command": "node",
            "args": [
              "./mcp-servers/perplexity-ask-server/perplexity-ask-mcp.js"
            ],
            "env": {
              "PERPLEXITY_API_KEY": "${PERPLEXITY_API_KEY}",
              "DEBUG": "false"
            },
            "description": "Advanced Perplexity research with automated workflows and fact-checking"
          },
          "advanced-ai-integration": {
            "command": "node",
            "args": [
              "./src/api/ai-integration/grok4-mcp-server.js"
            ],
            "env": {
              "PERPLEXITY_API_KEY": "${PERPLEXITY_API_KEY}",
              "DEBUG": "false"
            },
            "description": "Advanced AI reasoning via Perplexity API with native tool use and multi-agent reasoning"
          },
          "browser-automation": {
            "command": "node",
            "args": [
              "./mcp-servers/browser-automation/browser-automation-mcp.js"
            ],
            "env": {
              "DEBUG": "false"
            },
            "description": "Advanced browser automation with performance monitoring and error handling"
          },
          "github-integration": {
            "command": "npx",
            "args": [
              "@modelcontextprotocol/server-github"
            ],
            "env": {
              "GITHUB_PERSONAL_ACCESS_TOKEN": "${GITHUB_PERSONAL_ACCESS_TOKEN}"
            },
            "description": "GitHub repository management and automation"
          },
          "music-research": {
            "command": "node",
            "args": [
              "./scripts/music-research-automation.js"
            ],
            "env": {
              "PERPLEXITY_API_KEY": "${PERPLEXITY_API_KEY}",
              "DEBUG": "false"
            },
            "description": "Automated music research using Perplexity API for trend analysis and artist discovery"
          }
        }
      },
      "analysis": {
        "content": "Mock response for: Analyze this MCP server configuration for EchoTune AI and create an integration map:\n\nMCP Configuration: {\n  \"$schema\": \"https://modelcontextprotocol.io/schema/cursor-mcp.json\",\n  \"mcpServers\": {\n    \"echotune-perplexity\": {\n      \"command\": \"node\",\n      \"args\": [\n        \"./mcp-servers/perplexity-mcp/perplexity-mcp-server.js\"\n      ],\n      \"env\": {\n        \"PERPLEXITY_API_KEY\": \"${PERPLEXITY_API_KEY}\",\n        \"PERPLEXITY_MODEL\": \"llama-3.1-sonar-small-128k-online\",\n        \"PERPLEXITY_MAX_LATENCY_MS\": \"1500\",\n        \"PERPLEXITY_MAX_MEMORY_MB\": \"256\",\n        \"PERPLEXITY_COST_BUDGET_USD\": \"0.50\",\n        \"DEBUG\": \"true\"\n      }\n    },\n    \"echotune-filesystem\": {\n      \"command\": \"npx\",\n      \"args\": [\n        \"@modelcontextprotocol/server-filesystem\",\n        \"./src\",\n        \"./scripts\",\n        \"./mcp-server\"\n      ],\n      \"env\": {}\n    },\n    \"package-manager\": {\n      \"command\": \"node\",\n      \"args\": [\n        \"./mcp-servers/package-management/package-version-mcp.js\"\n      ],\n      \"env\": {}\n    },\n    \"analytics\": {\n      \"command\": \"node\",\n      \"args\": [\n        \"./mcp-servers/analytics-server/analytics-mcp.js\"\n      ],\n      \"env\": {}\n    },\n    \"testing\": {\n      \"command\": \"node\",\n      \"args\": [\n        \"./mcp-servers/testing-automation/testing-automation-mcp.js\"\n      ],\n      \"env\": {}\n    },\n    \"brave-search\": {\n      \"command\": \"npx\",\n      \"args\": [\n        \"@modelcontextprotocol/server-brave-search\"\n      ],\n      \"env\": {\n        \"BRAVE_API_KEY\": \"${BRAVE_API_KEY}\"\n      }\n    },\n    \"browserbase\": {\n      \"command\": \"node\",\n      \"args\": [\n        \"./mcp-servers/browserbase/browserbase-mcp.js\"\n      ],\n      \"env\": {\n        \"BROWSERBASE_API_KEY\": \"${BROWSERBASE_API_KEY}\",\n        \"BROWSERBASE_PROJECT_ID\": \"${BROWSERBASE_PROJECT_ID}\",\n        \"BROWSERBASE_SESSION_ID\": \"${BROWSERBASE_SESSION_ID}\"\n      }\n    },\n    \"memory\": {\n      \"command\": \"npx\",\n      \"args\": [\n        \"@modelcontextprotocol/server-memory\"\n      ],\n      \"env\": {\n        \"MEMORY_DB_PATH\": \".cursor/memory.sqlite\",\n        \"MEMORY_MAX_MB\": \"64\"\n      }\n    },\n    \"perplexity-ask\": {\n      \"command\": \"node\",\n      \"args\": [\n        \"./mcp-servers/perplexity-ask-server/perplexity-ask-mcp.js\"\n      ],\n      \"env\": {\n        \"PERPLEXITY_API_KEY\": \"${PERPLEXITY_API_KEY}\",\n        \"DEBUG\": \"false\"\n      },\n      \"description\": \"Advanced Perplexity research with automated workflows and fact-checking\"\n    },\n    \"advanced-ai-integration\": {\n      \"command\": \"node\",\n      \"args\": [\n        \"./src/api/ai-integration/grok4-mcp-server.js\"\n      ],\n      \"env\": {\n        \"PERPLEXITY_API_KEY\": \"${PERPLEXITY_API_KEY}\",\n        \"DEBUG\": \"false\"\n      },\n      \"description\": \"Advanced AI reasoning via Perplexity API with native tool use and multi-agent reasoning\"\n    },\n    \"browser-automation\": {\n      \"command\": \"node\",\n      \"args\": [\n        \"./mcp-servers/browser-automation/browser-automation-mcp.js\"\n      ],\n      \"env\": {\n        \"DEBUG\": \"false\"\n      },\n      \"description\": \"Advanced browser automation with performance monitoring and error handling\"\n    },\n    \"github-integration\": {\n      \"command\": \"npx\",\n      \"args\": [\n        \"@modelcontextprotocol/server-github\"\n      ],\n      \"env\": {\n        \"GITHUB_PERSONAL_ACCESS_TOKEN\": \"${GITHUB_PERSONAL_ACCESS_TOKEN}\"\n      },\n      \"description\": \"GitHub repository management and automation\"\n    },\n    \"music-research\": {\n      \"command\": \"node\",\n      \"args\": [\n        \"./scripts/music-research-automation.js\"\n      ],\n      \"env\": {\n        \"PERPLEXITY_API_KEY\": \"${PERPLEXITY_API_KEY}\",\n        \"DEBUG\": \"false\"\n      },\n      \"description\": \"Automated music research using Perplexity API for trend analysis and artist discovery\"\n    }\n  }\n}\n\nPlease provide:\n1. Integration architecture overview\n2. Data flow analysis\n3. Dependencies and relationships\n4. Performance bottlenecks\n5. Security considerations\n6. Optimization opportunities\n7. Integration map diagram description\n\nThis is a simulated Perplexity API response. To get real results, configure PERPLEXITY_API_KEY environment variable.\n\nKey findings:\n- Analysis of Analyze this MCP server configuration for EchoTune AI and create an integration map:\n\nMCP Configuration: {\n  \"$schema\": \"https://modelcontextprotocol.io/schema/cursor-mcp.json\",\n  \"mcpServers\": {\n    \"echotune-perplexity\": {\n      \"command\": \"node\",\n      \"args\": [\n        \"./mcp-servers/perplexity-mcp/perplexity-mcp-server.js\"\n      ],\n      \"env\": {\n        \"PERPLEXITY_API_KEY\": \"${PERPLEXITY_API_KEY}\",\n        \"PERPLEXITY_MODEL\": \"llama-3.1-sonar-small-128k-online\",\n        \"PERPLEXITY_MAX_LATENCY_MS\": \"1500\",\n        \"PERPLEXITY_MAX_MEMORY_MB\": \"256\",\n        \"PERPLEXITY_COST_BUDGET_USD\": \"0.50\",\n        \"DEBUG\": \"true\"\n      }\n    },\n    \"echotune-filesystem\": {\n      \"command\": \"npx\",\n      \"args\": [\n        \"@modelcontextprotocol/server-filesystem\",\n        \"./src\",\n        \"./scripts\",\n        \"./mcp-server\"\n      ],\n      \"env\": {}\n    },\n    \"package-manager\": {\n      \"command\": \"node\",\n      \"args\": [\n        \"./mcp-servers/package-management/package-version-mcp.js\"\n      ],\n      \"env\": {}\n    },\n    \"analytics\": {\n      \"command\": \"node\",\n      \"args\": [\n        \"./mcp-servers/analytics-server/analytics-mcp.js\"\n      ],\n      \"env\": {}\n    },\n    \"testing\": {\n      \"command\": \"node\",\n      \"args\": [\n        \"./mcp-servers/testing-automation/testing-automation-mcp.js\"\n      ],\n      \"env\": {}\n    },\n    \"brave-search\": {\n      \"command\": \"npx\",\n      \"args\": [\n        \"@modelcontextprotocol/server-brave-search\"\n      ],\n      \"env\": {\n        \"BRAVE_API_KEY\": \"${BRAVE_API_KEY}\"\n      }\n    },\n    \"browserbase\": {\n      \"command\": \"node\",\n      \"args\": [\n        \"./mcp-servers/browserbase/browserbase-mcp.js\"\n      ],\n      \"env\": {\n        \"BROWSERBASE_API_KEY\": \"${BROWSERBASE_API_KEY}\",\n        \"BROWSERBASE_PROJECT_ID\": \"${BROWSERBASE_PROJECT_ID}\",\n        \"BROWSERBASE_SESSION_ID\": \"${BROWSERBASE_SESSION_ID}\"\n      }\n    },\n    \"memory\": {\n      \"command\": \"npx\",\n      \"args\": [\n        \"@modelcontextprotocol/server-memory\"\n      ],\n      \"env\": {\n        \"MEMORY_DB_PATH\": \".cursor/memory.sqlite\",\n        \"MEMORY_MAX_MB\": \"64\"\n      }\n    },\n    \"perplexity-ask\": {\n      \"command\": \"node\",\n      \"args\": [\n        \"./mcp-servers/perplexity-ask-server/perplexity-ask-mcp.js\"\n      ],\n      \"env\": {\n        \"PERPLEXITY_API_KEY\": \"${PERPLEXITY_API_KEY}\",\n        \"DEBUG\": \"false\"\n      },\n      \"description\": \"Advanced Perplexity research with automated workflows and fact-checking\"\n    },\n    \"advanced-ai-integration\": {\n      \"command\": \"node\",\n      \"args\": [\n        \"./src/api/ai-integration/grok4-mcp-server.js\"\n      ],\n      \"env\": {\n        \"PERPLEXITY_API_KEY\": \"${PERPLEXITY_API_KEY}\",\n        \"DEBUG\": \"false\"\n      },\n      \"description\": \"Advanced AI reasoning via Perplexity API with native tool use and multi-agent reasoning\"\n    },\n    \"browser-automation\": {\n      \"command\": \"node\",\n      \"args\": [\n        \"./mcp-servers/browser-automation/browser-automation-mcp.js\"\n      ],\n      \"env\": {\n        \"DEBUG\": \"false\"\n      },\n      \"description\": \"Advanced browser automation with performance monitoring and error handling\"\n    },\n    \"github-integration\": {\n      \"command\": \"npx\",\n      \"args\": [\n        \"@modelcontextprotocol/server-github\"\n      ],\n      \"env\": {\n        \"GITHUB_PERSONAL_ACCESS_TOKEN\": \"${GITHUB_PERSONAL_ACCESS_TOKEN}\"\n      },\n      \"description\": \"GitHub repository management and automation\"\n    },\n    \"music-research\": {\n      \"command\": \"node\",\n      \"args\": [\n        \"./scripts/music-research-automation.js\"\n      ],\n      \"env\": {\n        \"PERPLEXITY_API_KEY\": \"${PERPLEXITY_API_KEY}\",\n        \"DEBUG\": \"false\"\n      },\n      \"description\": \"Automated music research using Perplexity API for trend analysis and artist discovery\"\n    }\n  }\n}\n\nPlease provide:\n1. Integration architecture overview\n2. Data flow analysis\n3. Dependencies and relationships\n4. Performance bottlenecks\n5. Security considerations\n6. Optimization opportunities\n7. Integration map diagram description\n- Relevant insights and recommendations\n- Technical implementation details\n- Performance considerations",
        "citations": [
          {
            "url": "https://example.com/source1",
            "snippet": "Mock citation 1"
          },
          {
            "url": "https://example.com/source2",
            "snippet": "Mock citation 2"
          }
        ],
        "model": "grok-4",
        "usage": {
          "tokens": 150
        }
      },
      "aiPatterns": {
        "content": "Mock response for: Research best practices for integrating multiple AI providers (OpenAI, Gemini, Claude, Perplexity) in a music discovery platform with real-time features\n\nThis is a simulated Perplexity API response. To get real results, configure PERPLEXITY_API_KEY environment variable.\n\nKey findings:\n- Analysis of Research best practices for integrating multiple AI providers (OpenAI, Gemini, Claude, Perplexity) in a music discovery platform with real-time features\n- Relevant insights and recommendations\n- Technical implementation details\n- Performance considerations",
        "citations": [
          {
            "url": "https://example.com/source1",
            "snippet": "Mock citation 1"
          },
          {
            "url": "https://example.com/source2",
            "snippet": "Mock citation 2"
          }
        ],
        "model": "sonar-pro",
        "usage": {
          "tokens": 150
        }
      },
      "timestamp": "2025-08-16T16:48:07.163Z"
    },
    "recommendations": {
      "content": "Mock response for: Based on the analysis of EchoTune AI music discovery platform, provide specific recommendations for:\n\n1. **Architecture Improvements**\n   - Microservices optimization\n   - Database performance\n   - Caching strategies\n   - Real-time features\n\n2. **AI Integration Enhancements**\n   - Multi-provider orchestration\n   - Response time optimization\n   - Cost reduction strategies\n   - Quality improvements\n\n3. **Security Hardening**\n   - API security\n   - Data protection\n   - Authentication improvements\n   - Compliance considerations\n\n4. **Performance Optimization**\n   - Loading time reduction\n   - Memory usage optimization\n   - Scalability improvements\n   - Monitoring enhancements\n\n5. **User Experience**\n   - Mobile optimization\n   - PWA features\n   - Accessibility improvements\n   - Personalization features\n\n6. **Development Workflow**\n   - CI/CD improvements\n   - Testing automation\n   - Documentation updates\n   - Deployment optimization\n\nProvide specific, actionable recommendations with implementation priorities (High/Medium/Low).\n\nThis is a simulated Perplexity API response. To get real results, configure PERPLEXITY_API_KEY environment variable.\n\nKey findings:\n- Analysis of Based on the analysis of EchoTune AI music discovery platform, provide specific recommendations for:\n\n1. **Architecture Improvements**\n   - Microservices optimization\n   - Database performance\n   - Caching strategies\n   - Real-time features\n\n2. **AI Integration Enhancements**\n   - Multi-provider orchestration\n   - Response time optimization\n   - Cost reduction strategies\n   - Quality improvements\n\n3. **Security Hardening**\n   - API security\n   - Data protection\n   - Authentication improvements\n   - Compliance considerations\n\n4. **Performance Optimization**\n   - Loading time reduction\n   - Memory usage optimization\n   - Scalability improvements\n   - Monitoring enhancements\n\n5. **User Experience**\n   - Mobile optimization\n   - PWA features\n   - Accessibility improvements\n   - Personalization features\n\n6. **Development Workflow**\n   - CI/CD improvements\n   - Testing automation\n   - Documentation updates\n   - Deployment optimization\n\nProvide specific, actionable recommendations with implementation priorities (High/Medium/Low).\n- Relevant insights and recommendations\n- Technical implementation details\n- Performance considerations",
      "citations": [
        {
          "url": "https://example.com/source1",
          "snippet": "Mock citation 1"
        },
        {
          "url": "https://example.com/source2",
          "snippet": "Mock citation 2"
        }
      ],
      "model": "grok-4",
      "usage": {
        "tokens": 150
      }
    }
  },
  "recommendations": [
    "Mock response for: Based on the analysis of EchoTune AI music discovery platform, provide specific recommendations for:",
    "- Quality improvements",
    "- Authentication improvements",
    "- Scalability improvements",
    "- Accessibility improvements",
    "- CI/CD improvements",
    "Provide specific, actionable recommendations with implementation priorities (High/Medium/Low).",
    "- Analysis of Based on the analysis of EchoTune AI music discovery platform, provide specific recommendations for:",
    "- Quality improvements",
    "- Authentication improvements"
  ],
  "nextSteps": [
    "Review and implement high-priority recommendations",
    "Update documentation based on research findings",
    "Optimize performance bottlenecks identified",
    "Enhance security measures as recommended",
    "Plan roadmap updates based on technology research",
    "Implement monitoring improvements",
    "Schedule regular research updates"
  ],
  "appendix": {
    "evidenceArtifacts": [],
    "cacheStatistics": {
      "totalCachedQueries": 0,
      "cacheHitRate": "N/A",
      "averageResponseTime": "N/A"
    },
    "performanceMetrics": {
      "totalResearchQueries": 0,
      "successfulQueries": 0,
      "averageQueryTime": "N/A",
      "totalTokensUsed": "N/A"
    }
  }
}