{
  "task_id": "roadmap_task_2",
  "title": "2. Music AI/ML Trends & Integration\n- **Integrate state-of-the-art music feature extraction librarie...",
  "description": "2. Music AI/ML Trends & Integration\n- **Integrate state-of-the-art music feature extraction libraries** (e.g., librosa, Essentia) for enhanced audio analysis (Priority: High).\n- **Prototype generative music models** (e.g., MusicLM, Jukebox) for AI-driven composition or remix features (Priority: Medium).\n- **Implement Retrieval Augmented Generation (RAG) pipelines** for smarter music recommendations and metadata enrichment[2] (Priority: Medium).",
  "files_to_modify": [
    "src/"
  ],
  "implementation_steps": [
    "Analyze current implementation",
    "Identify specific changes needed",
    "Implement the changes",
    "Test the implementation",
    "Update documentation if needed"
  ],
  "complexity_score": 10,
  "implementation_plan": "## Implementation Plan for: 2. Music AI/ML Trends & Integration\n- **Integrate state-of-the-art music feature extraction librarie...\n\n### Complexity Assessment\n- Complexity Score: 10/10\n- Estimated Duration: 90-120 minutes\n- Priority: medium\n\n### Target Files/Directories\n- src/\n\n### Implementation Steps\n1. Analyze current implementation\n2. Identify specific changes needed\n3. Implement the changes\n4. Test the implementation\n5. Update documentation if needed\n\n### Success Criteria\n- All implementation steps completed successfully\n- Code changes follow project standards\n- Appropriate tests added or updated\n- Documentation updated as needed\n\n### Risk Assessment\n- Complexity Level: High\n- Breaking Change Risk: Low\n- Testing Requirements: Extensive",
  "status": "completed",
  "execution_time": "2025-08-27T04:26:04.342156",
  "estimated_duration": "90-120 minutes"
}